id,chinese,translation
f748e1d8ef48e415594e4b8b35c707fdd3ee81f5,é€™æ™‚å€™ æˆ‘æ¯è¦ªçš„å¦¹å¦¹ç‰è‹±é˜¿å§¨åœ¨æˆ‘å®¶ä½ å¥¹æ€•æˆ‘å†·äº† æ‹¿äº†ä¸€ä»¶è¡£æœå‡ºä¾†å«æˆ‘ç©¿ä¸Š,Ini waktu Ibu saya adik perempuan Yue Ying bibi tinggal di rumah saya Dia takut saya dingin Lha ambil satu pakaian keluar minta saya pakai
9d40eeb46d701b08e7c00145eb5ff50c90f01eb1,ä¼¸é•·äº†è—¤è”“è¼•è¼•åœ°å¾€å±‹é ‚ä¸Šçˆ¬,Terselenggarakan vineè”“ perlahan-lahan ke atap
37c868d2194106fd7a4e1a5cd8a57461ab9106ac,åªæœ‰ç¶ è‰²çš„å°æ²³é‚„é†’è‘—,Hanya sungai kecil hijau yang masih bangun
5eba2486e2ed2919a60e4cc17dbfd014a512db89,ä½è²åœ°æ­Œå”±è‘—æºœéå½å½çš„å°æ©‹,Menerima lagu dengan suara rendah melintasi jembatan kecil yang melengkung
8e007efd249834b6b216469f6b3e357c7dd02f55,åªæœ‰å¤œé¢¨é‚„é†’è‘—,Hanya angin malam yang masih bangun
2dd3e55ddd432d710836b886dc1076f051363ab3,å¾ç«¹æ—è£¡è·‘å‡ºä¾†,Dari hutan bambu keluar berlari
984f8dbc6271db04f1ebb2c77a2c75ccf085146a,åœ¨ç¾éº—çš„å¤å¤œè£¡æ„‰å¿«åœ°æ—…è¡Œ,Travel yang menyenangkan di malam musim panas yang indah
a4ca14ddf975ca32f55ac38d5ff060903a67d8a2,èº«å¾Œäº‹,Kehidupan belakang
18b0b4d28133b2240b4c21255339836ffadb648b,å¹¾æ¯å¾Œ ä½ å¿½ç„¶æƒ³åˆ°äº†ä»¥å¾Œçš„äº‹, Beberapa cangkir kemudian Anda tiba-tiba memikirkan hal yang a kemudian
4248dc9c658c97338640056bf718c4cb148e214e,ä¸€å¥åè‘—ä¸€å¥,Satu kalimat muntah satu kalimat
c7c454cea18def83ff9c21fa82e1559878e5b498,æœ‰é¢¨å¹ä¾† å¤¾å¸¶çš„å¡µåŸƒè®“æˆ‘çªç„¶æ¸ºå°,Ada angin yang angin  korek belt debu yang membuat saya tiba kecil
4a3a6b80e96d218d37e117fb2004edc7e76a3c2c,å°±æ˜¯æˆ‘æ€•ç«å§,Itulah saya takut api.
e76ac682410bfbd85ff4f2fff9e222a346064bb1,æˆ‘å‰›èªªäº†é€™å¥è©± ä¸€æŠ¬é ­ çœ‹è¦‹æ¯è¦ªå¾å®¶è£¡èµ°å‡º æˆ‘è¶•å¿«æŠŠè¡£æœç©¿ä¸Š ä½†å¥¹å·²è½è¦‹é€™å¥è¼•è–„çš„è©±äº†,Sayaå‰›èªªäº†é€™å¥è©± ä¸€æŠ¬é ­çœ‹è¦‹æ¯è¦ªå¾å®¶è£¡èµ°å‡º æˆ‘è¶•å¿«æŠŠè¡£æœç©¿ä¸Š ä½†å¥¹å·²è½è¦‹é€™å¥è¼•è–„çš„è©±äº†
43435520968ea5bca15f73dc6078bc575f0da70d,å¥¹æ°£å¾—åè‘—ç™¼æŠ– ä¹Ÿä¸è¨±æˆ‘ä¸ŠåºŠä¸Šç¡,Dia harus gas duduk dengan gemetar dan juga tak berijin aku naik ke tempat tidur di tempat tidur
1d19cbb4a651e81642c39cf5d23567ae4cf88d87,æˆ‘è·ªè‘—å“­ ç”¨æ‰‹æ“¦çœ¼æ·š ä¸çŸ¥æ“¦é€²äº†ä»€éº¼é»´èŒ å¾Œä¾†è¶³è¶³å®³äº†ä¸€å¹´å¤šçš„çœ¼ç¿³ç—… é†«ä¾†é†«å» ç¸½é†«ä¸å¥½,Saya berlutut menangis Dengan tangan gosok air mata tidak tahu gosok masuknya apa jamur  kemudian cukup cukup merusak lebih dari setahun penyakit mata  medis datang medis pergi Umum pengobatan tidak
5973b12b9c5505c643331c3437699740312093c9,ä½ å€‘å¾ä¾†ä¸çŸ¥é“ åªæ˜¯æˆ‘å€‘çš„åœ°æ„ˆä¾†æ„ˆå°‘äº†,Kamu tidak pernah tahu Hanya tanah kita semakin semakin sedikit
92d36dcffd59827b0cabcc2e935e45e540bf99b6,ä¸è¦æ‡·å¿µæˆ‘ é€™è£¡ æ²’æœ‰äººæ‡‚å¾—é‚£è‹¦æ¾€çš„ä¸€ç”Ÿ,Jangan kangen saya Di sini tidak ada yang mengerti yang penderitaan seumur hidup
9f23cc1551e78a8c1918f37e1ee8c1db0e540c58,ä¸è¦è«‹å®—æ•™äººå£«ä¾† ä»–å€‘çš„å”±è®ƒ æ²’æœ‰æˆ‘å€‘å‚³çµ±æ­Œè¬ å¥½è½,Jangan undang orang agama datang Mereka nyanyi Tidak kita tradisional nyanyian baik dengar
534b349b85a52174360c388edd472280ff555157,åœæ”¾ä¸‰å¤©å§ æˆ‘è¦ç­‰ä¸€å€‹äºº,Tersisih tiga hari saja. Aku tunggu seorang
4b658da263fbfcdb0262576e79737c4200fcadb5,ä¸‰å¤©å¾Œæ²’ä¾† é‚£å°±ç®—äº†,Tiga hari kemudian nggak datang Itu sudah berhitung
9bdd620763881597004c70d8d2935641092ee4d2,æœ‰çš„äººåƒ…åƒ…ä»£è¡¨ç¾éº—çš„åˆ¹é‚£,Ada orang yang hanya mewakili indah yangåˆ¹é‚£
947c75d6dfeb1f14ea644dde16ee8e0e417da127,ç¸½æœƒéŒ¯é,Selalu akan lewatkan
08852f68aba29f0eb64b2971264873b08e7e8503,é‚£å€‹æœ¨ç®±è£¡ ä¸ç”¨è£å¤ªå¤šè¡£ç‰©,Itu peti kayu itu tidak perlu memuat terlalu banyak pakaian
1c9c5c3a0c926e45d7226cee5ecb6b942b8a4838,æˆ‘æ¯è¦ªå¿ƒè£¡åˆæ‚”åˆæ€¥ è½èªªçœ¼ç¿³å¯ä»¥ç”¨èˆŒé ­èˆ”å» æœ‰ä¸€å¤œå¥¹æŠŠæˆ‘å«é†’ çœŸç”¨èˆŒé ­èˆ”æˆ‘çš„ç—…çœ¼ é€™æ˜¯æˆ‘çš„åš´å¸« æˆ‘çš„æ…ˆæ¯,Ibu saya hatinya lagi menyesal dan cepat  dengarnya air mata bisa pakai lidahèˆ” pergi Ada satu malam dia menyuruh saya bangun bener pakai lidahèˆ” mata sakit saya Inilah sayaåš´å¸« sayaæ…ˆæ¯
8fcc5e12daeedd8505b6f8b2ad88444428bfdc4d,æˆ‘åœ¨æˆ‘æ¯è¦ªçš„æ•™è¨“ä¹‹ä¸‹ä½äº†ä¹å¹´ å—äº†æ¥µå¤§æ¥µæ·±çš„å½±éŸ¿ æˆ‘åå››æ­² å…¶å¯¦åªæœ‰åäºŒæ­²é›¶å…©ä¸‰å€‹æœˆ ä¾¿é›¢é–‹å¥¹äº†,Saya tinggal di bawah ajaran ibu saya selama sembilan tahun dan mendapat pengaruh yang sangat sangat mendalam saya berusia empat belas tahun sebenarnya hanya berusia dua belas tahun dua tiga bulan dan meninggalkan dia
bfefff75822ab5db5b3714635dff175fe4de8f0f,åœ¨é€™å»£å¤§é¼é—Šçš„äººç¾¤è£¡ ç¨è‡ªç³Šå¡—éäº†äºŒåå¤šå¹´ æ²’æœ‰ä¸€å€‹äººç®¡æŸéæˆ‘,"Di dalam orang-orang yang luas dan luas ini, sendirian melukis selama lebih dari dua puluh tahun dan tidak ada seorang pun yang membendung saya"
43cc179e008f7941aba0ec119fd88e22e228687a,å¦‚æœæˆ‘å­¸å¾—äº†ä¸€çµ²ä¸€æ¯«å¥½è„¾æ°£ å¦‚æœæˆ‘å­¸å¾—äº†ä¸€é»é»å¾…äººæ¥ç‰©çš„å’Œæ°£ å¦‚æœæˆ‘èƒ½å¯¬æ•äºº é«”è«’äºº æˆ‘éƒ½æ‡‰è©²æ„Ÿè¬æˆ‘çš„æ…ˆæ¯,"Jika saya belajar memiliki sedikit sedikit keberanian jika saya belajar memiliki sedikit sedikit terhadap orang yang terima dan suasana jika saya bisa memaafkan orang, memaafkan orang saya juga harus berterima kasih kepada ibu kasih saya"
c1b668ec07af3108b340ea570007b26c5c52cbfc,åœŸè£¡é¢ å“ªè£¡é‚„æ„Ÿè¦ºå¾—åˆ°ä¸–ä¸Šçš„ç‚æ¶¼,Tanah dalam  dimana masih merasa mendapatkan dunia yang panas sejuk
4df40d4d01a47c34369d05ecf046667e64dc1046,æˆ‘éœ€è¦é–€ç‰Œå— æˆ‘çš„å±…æ‰€åœ¨å“ªè£¡,Saya perlu pintuç‰Œå— Tempat tinggal saya berada dimana
3bf9ae366c7769c63d15d5187b2655be38734aea,æ‰¾ä¸€å€‹åƒæ¨£çš„çŸ³é ­å°±å¥½,Cari sebuah batu yang layak saja
747cbe9060416cd355d5a775c1c79c166720e153,ä¸Šé¢è¦åˆ»ä»€éº¼ æˆ‘æ˜¯èª°,Atas untuk teruk apa Saya Siapa
54e5104e3b399874d68439257b560d3a106de7f4,å«ä»€éº¼ æˆ‘æƒ³äº†ä¸€ç”Ÿäº†,å«ä»€éº¼ æˆ‘æƒ³äº†ä¸€ç”Ÿäº†
733b3ad493f00a2ee3b18fb00a2339df4b5a30c5,é‚£éº¼ åˆ»ä¸Šå¾ˆç—›å§,Kalau begitu åˆ»ä¸Š sangat sakit aja
b0aab54e4e3169407dfd8d46a46402a27fd95382,é€™è¼©å­ æˆ‘å¿è‘—å¾ä¾†æ²’èªªå‡ºå£,Iniè¼©å­ æˆ‘å¿è‘—å¾ä¾†æ²’èªªå‡ºå£
4229cc814da52c2027045608876dc53a00aa5990,æ‰€ä»¥ ä½ åˆ»çš„æ™‚å€™è¼•ä¸€é»,Jadi kauåˆ»çš„æ™‚å€™è¼•ä¸€é»
c43cafcf061d3aa743ad17979bf6b80f2a486ff7,æœ‰ç©ºå°±ä¾†åå é€™è£¡é¢¨ä¸æœƒå¾ˆå¤§,Ada kosong saja datang duduk duduk Di sini angin tidak besar
bc5efc0971899ec551390c71c95a0578ae5369c3,é‹ªå¼µå ±ç´™ é…¹ä¸€é»é…’ ç¥–å…ˆä¾¿æœƒåŒå¸­,é‹ªå¼µå ±ç´™ ä¸€é»é…’ ç¥–å…ˆä¾¿æœƒåŒå¸­
8fecfaf33ab513b9834a7c0872489b4c9c391f5f,æˆ‘å°±åœ¨é™„è¿‘ ä½ æœƒçœ‹è¦‹ä½ é»çµ¦æˆ‘çš„è¸é ­ä¸Šæœ‰æˆ‘çš„å·è¸,Saya berada di dekat Anda akan melihat Anda bagaimana bagi saya  kepalaku ada saya gul
95942c7650687e2617e1c00c34ab7505d78630fe,ä¸ç”¨ç¥ˆç¦± æˆ‘æ²¡æœ‰èƒ½åŠ›ä¿ä½‘ä½  ä¸€åˆ‡é è‡ªå·±,Tidak perlu berdoa Saya tidak memiliki kekuatan memberkati Anda Semuanya sendirian
44f2d573c107ec3a950672513ae95a9d9c8f76f1,èŠèŠå®¶äº‹ è«‡è«‡é‚£äº›æœæ¨¹é•·æœå¯¦äº†æ²’æœ‰,Chat rumah urusan è°ˆè°ˆé‚£äº›æœæ ‘é•¿æœå®äº†æ²¡æœ‰
1d3edcde430a44cb011685d09d6e70d78c56a229,æœ€è¿‘å¿™äº†ä»€éº¼ å­©å­æœ‰æ²’æœ‰è½è©±,Baru sibuk apa  anak apakah ada dengar kata
329d8858a8932e7c28470c9317d486b886eeb920,ä¸è¦æèˆŠäº‹ æˆ‘å“ªè£¡æœƒå¿˜è¨˜,"Jangan sebutkan lama hal, aku dimana akan lupa"
b401ebfffacb154852f8a628b1aa66c886ea4f95,ä½ çœ‹ çŸ³é ­ä¸Šçš„é‚£å€‹åå­—,Kau lihat nama yang pada batu itu
a9827985c161dde4898eaa015de0b4473187962c,ä¸è¦ææˆ‘å€‘çš„æœªä¾† ä¸€åˆ‡æˆ‘éƒ½æ—©å°±æ–™åˆ°,Jangan sebutkan masa depan kita Semuanya aku sudah lama menanti
3039ff52dc5b149b2183fab959e9d39ebc0126db,ä½ çœ‹ çŸ³é ­ä¸Šçš„é‚£å€‹åå­—,Kau lihat nama yang pada batu itu
64b56d4f6149817372d03061930334dbb345c056,æˆ‘æ­£åœ¨è®€æ›¸,Saya sedang membaca
bedcd17db9fe576c122a05cf9275ebdc07639f33,æˆ‘æ­£åœ¨æ´—è¡£æœ,Saya sedang mencuci pakaian
c5a5e3c8cab5190e36a7121d0fdda4b79ac2dd24,æˆ‘æ­£åœ¨æ´—è‡‰,Saya sedang mencuci wajah
71a13bcbf94ed54ed10486d27c8c1ab9a75b2e1c,é‚£äº›ç”·å­©å­æ­£åœ¨æ‹œè¨ªå¥¶å¥¶,Para anak laki-laki sedang mengunjungi nenek
0f995539b97fdb20592bb6d3cb5190d86902d016,é‚£äº›ç”·å­©å­æ­£åœ¨çœ‹é›»è¦–,Para anak laki-laki sedang menonton TV
0c077e285eea52761e8fa480d5210ff96ad16d6f,é‚£äº›ç”·å­©å­æ­£åœ¨è®€æ›¸,Para anak laki-laki sedang sekolah
234683da381bc3fa53d7c8a29ade32cb9e9911c1,ä½ æ­£åœ¨å”±æ­Œå—,Kau sedang bernyanyi?
19857072f77b156351682c351ec805d4d0172c91,ä½ æ­£åœ¨æ´—è‡‰å—,Anda sedang mencuci wajah?
dbcab20c8589fd67c31b3a4a049b16a7477ff0cf,ä½ æ­£åœ¨ç•«åœ–å—,Kau sedang menggambar?
637ab5029c28289fdb32b980f8a6e7f4e005cc09,æˆ‘å€‘æ­£åœ¨åƒ æ±è¥¿,Kami sedang makan Timur Barat
e2dbb6dc7cd6da0a9be36c3a7dfe68841cbd0b74,æˆ‘å€‘æ­£åœ¨å”±æ­Œ,Kita sedang menyanyi
b13af7aec0daec8788c71cdb0f3de1f764142ee5,æˆ‘å€‘æ­£åœ¨ç©è€,Kami sedang mainè€
72b84ab547e8da786b90d9385ad694a76e03f64f,é‚£å€‹ç”·å­©å­æ­£åœ¨ç•«åœ–,Anak itu sedang menggambar
1ffde6c7de5fd9df4a82f7996cb4d51a14dfa178,é‚£å€‹ç”·å­©å­æ­£åœ¨è·³èˆ,Anak laki-laki itu sedang menari
9406e8e4010df796eae7adcf17de019c08a42d43,é‚£å€‹ç”·å­©å­æ­£åœ¨å”±æ­Œ,Anak laki-laki itu sedang bernyanyi
08c39a16fbd62cae621922399540b329fe8c38b1,æˆ‘å–œæ­¡å»å­¸æ ¡ å­¸ç•«ç•« è®€æ›¸ å”±æ­Œ è·³èˆ æˆ‘æ¯å¤©éƒ½å¾ˆé«˜èˆˆ æˆ‘ç•«çš„åœ–å¾ˆæ¼‚äº® æˆ‘ ä¹Ÿ å¾ˆæœƒè®€æ›¸ è€å¸«å¾ˆå–œæ­¡æˆ‘ åœ¨å®¶è£¡ çˆ¸çˆ¸ åª½åª½ å“¥å“¥ å¦¹å¦¹å…¨éƒ½å–œæ­¡è½æˆ‘å”±æ­Œ çœ‹æˆ‘è·³èˆ,Saya suka pergi sekolah  belajar melukis  membaca  bernyanyi  menari Saya setiap hari sangat senang Saya gambarnya gambar sangat cantik Saya juga sangat akan membaca Guru guru sangat suka saya Di rumah  ayah  ibu  saudara  saudara perempuan semua suka mendengarkan saya bernyanyi Lihat saya menari
24ac122bfb8c1801bd7000c62329b752ac6ad61d,ä½ å¥½å—,Anda baik?
878d594512a2106c1f7fbf639680e7b9c55a8585,ä½ ä»Šå¤©å¾å“ªè£¡ä¾†,Kau hari ini dari mana datang
2f6675ea690ed84abe3faa4a045972bb15a33df5,ä½ å€‘å®¶æœ‰å¤šå°‘äºº,Berapa orang kalian di rumah
cce32aa72a84b423c1b15d05e8b787517b897e22,ä½ æ˜¯åŸä½æ°‘å—,Anda adalah penduduk asli?
8ac40b38d9c926162120fcd885e09f5baebdf863,ä½ æœƒèªªæ—èªå—,Anda akan bilang suku bahasa?
c53d4e023de410270ae4825dac9584ed3de487ae,ä½ ä»Šå¤©å¥½å—,Anda hari ini baik?
5664de04405f36e30445ea611d65b92955649d3c,ä½ ç¾åœ¨åœ¨å“ªè£¡,Kau sekarang di mana
75d556517a6ec8be97b6d6fa20542c9e062224f9,ä½ æœ‰å¹¾å€‹å…„å¼Ÿå§Šå¦¹,Anda punya beberapa saudara perempuan
81b9b5f8afe9e7726a853660cb78ca4ee764b581,ä½ æ˜¯å­¸ç”Ÿå—,Anda adalah mahasiswa?
ff5673bad56a9c8c6f9b6eb5e8e7117346d7e362,ä½ å–œæ­¡è®€æ›¸å—,Anda menyukai membaca?
c4e5dfbe0ceda51fb9248c602b3c51d91a06141d,ä½ å«ç”šéº¼åå­—,Kau panggil apa nama
629d07a6929354422f1a11903c4def57d9524687,ä½ å€‘å®¶åœ¨å“ªè£¡,Kamu rumah di mana
49acd4855e615aef3437f346d7fa165aa22923cd,ä½ å¹¾æ­²äº†,Kau berapa tahunnya?
ceda1862b5fb9ff7512d1b49b3648166ec16b4a7,ä½ å¾ˆé«˜å—,Kau tinggi?
d84792d497a64f33b70d49325618c00addeeed85,ä½ å–œæ­¡å­¸æ—èªå—,Anda menyukai belajar suku bahasa?
40d3d15e0a861c77fa641f6e517fd539961a1943,ä½ å¥½å—,Anda baik?
0a0215d6f2bd931fc49614e2c9159a756fffa39c,ä½ çš„å­¸æ ¡åœ¨å“ªè£¡,Sekolahmu di mana
710fc387f30c089c6232f5c2762ae27c4b88fa56,ä½ æœ‰å¹¾å€‹æœ‹å‹,Anda punya beberapa teman
9a0cb5ba3ce07ea29c4b877c44e9eb4db2ce90b5,ä½ å€‘å¤©å¤©ä¸€èµ·è®€æ›¸å—,Kamu sehari bersama membaca?
a3e5e81c728bd5e79d9e7499f19116147ebfa513,ä½ å€‘æœƒèªªæ—èªå—,Kamu akan bilang suku bahasa?
a02d93944862cd5cc1660a00e3a2d617b7f46113,ä½ å«ç”šéº¼åå­—,Kau panggil apa nama
856dcd3c99060bd34d50f8ff2c382651e0cdb68b,ä½ ç­‰ä¸€ä¸‹è¦å»å“ªè£¡,Anda tunggu saja pergi ke mana
1c35b4a12cc27c079d1d98eeb48fd9d757622762,ä½ å€‘å®¶æœ‰å¹¾å°é›»è¦–,Kalian punya beberapa TV di rumah
b96eca8356ec840c925a56eaf30a386da7c12cc0,ä½ å¤©å¤©çœ‹é›»è¦–å—,Anda tiap nonton televisi?
ed021840d1bf82e55a2889373971eb01170c8c5b,ä½ å–œæ­¡çœ‹é›»è¦–å—,Anda suka nonton televisi?
d3705a3d6d3af994caf3c96104817d729327f6ce,ä½ å¥½å—,Anda baik?
14386db6678deba36b1c1b66afc014a32df45caa,ä½ ä»Šå¤©å¾å“ªè£¡ä¾†,Kau hari ini dari mana datang
c8eef061f4dff115aed4bab7d948fd4d7b15f9f6,ä½ å€‘å®¶æœ‰å¤šå°‘äºº,Berapa orang kalian di rumah
ac91772f7919e5dc6752a6749deb41938dd5a921,ä½ çˆ¸çˆ¸æ˜¯åŸä½æ°‘å—,Ayahmu adalah pribumi?
6e9878067f91a2ff839d7143ea5c6f3bc7d66ace,ä½ æœƒèªªæ—èªå—,Anda akan bilang suku bahasa?
b64091d3e57ec34493877d1d6acd157f24831417,ä½ ä»Šå¤©å¥½å—,Anda hari ini baik?
9b7c67d09f8d535ebec02f2c29aecb063ef06006,ä½ ç¾åœ¨åœ¨å“ªè£¡,Kau sekarang di mana
8105fa1b28da7c052ae2cfc57b5832d0ba9dff2c,ä½ æœ‰å¹¾å€‹å…„å¼Ÿå§Šå¦¹,Anda punya beberapa saudara perempuan
fa9e3b333d1b3b183477652a105b424a739202e2,ä½ çš„å…„å¼Ÿå§Šå¦¹ä¹Ÿæ˜¯å­¸ç”Ÿå—,Saudara saudaramu juga mahasiswa?
e5094ecfd12cefab2850f65e5f9171f01db23721,ä½ å€‘éƒ½å–œæ­¡å”±æ­Œå—,Kamu semua suka menyanyi?
0a35ec15fa4499b0f0235964b3f589bbc13c3975,ä½ å«ç”šéº¼åå­—,Kau panggil apa nama
cb470be2488853253b5ddb64027398695a19934b,ä½ åª½åª½ç¾åœ¨åœ¨å“ªè£¡,Ibu Anda sekarang di mana
16dee5d02a42de10c26e3c87eaea10a4827a2793,å¥¹å¹¾æ­²äº†,Dia berapa tahunnya
12ea632d5c7cd70e454b38ae49b05e2fa1b5bd32,å¥¹å¾ˆé«˜å—,Dia tinggi nggak?
a075dd823f363e4e597b2ba679049c80431007d6,ä½ åª½åª½å¸¸èªªæ—èªå—,Anda ibu sering bilang suku bahasa?
e27dfa0938e2ed2e769c6d5196533a59ef051f99,ä½ å¥½å—,Anda baik?
83410d78dbe3156d8cbd588116c8d8f4b76c5721,ä½ ç¥–çˆ¶ç¥–æ¯ç¾åœ¨åœ¨å“ªè£¡,Kakek nenekmu sekarang berada di mana
e80a93d7d3c57d47b24266fbf250ebaa37d29bc4,ä»–å€‘æœ‰å¹¾å€‹å­©å­,Mereka memiliki beberapa anak
0f20d9b221c2269559316781eb61321ff26e6d1d,ä½ å¸¸å»æ¢æœ›ç¥–çˆ¶ç¥–æ¯å—,Anda sering pergi mengunjungi kakek nenek?
7800e201e799b59b1fdcdc9cf31b25e9b707b59e,ä½ çš„ç¥–çˆ¶ç¥–æ¯å¾ˆæœƒèªªæ—èªå—,Kakek nenekmu sangat akan bicara suku bahasa?
cdb95beeb4b74bfa3fc760bfbaab76647a0d7132,ä½ å«ç”šéº¼åå­—,Kau panggil apa nama
5c27db4c694ade1a8c0502c8ec784c094edfb91b,ä½ çš„å­¸æ ¡åœ¨å“ªè£¡,Sekolahmu di mana
c87450d13768ffc7818b3dbbb3eb7371751ec3a4,ä½ æœ‰å¹¾å€‹æœ‹å‹,Anda punya beberapa teman
b8699dd8f82dfaaad5268b20aff8f26aef0a285c,ä½ å–œæ­¡ä½ çš„æœ‹å‹å—,Anda menyukai teman Anda?
bfd6ff621edd09ef9b56682d6d3c2c35faa3eab5,ä½ å–œæ­¡ç•«ç•«å—,Anda suka melukis?
8f70654a1d0e7d3a0fe85172a38c2e34c7d4414d,ä½ å€‘å®¶æœ‰å¹¾å€‹äºº æˆ‘å€‘å®¶æœ‰å…­å€‹äºº,Kalian ada berapa orang kami ada enam orang
6fe1df382c894471e5497d5e8e899cbd1f4bdae3,ä»–æ˜¯è€å¸«å— ä¸æ˜¯ ä»–æ˜¯é†«ç”Ÿ,Dia guru? Bukan Dia dokter
71fbca9cbf35585b1869aa6fc3a97d60f2a92464,ä½ æ€éº¼å•¦ æˆ‘çš„é ­å¾ˆç—›,Kau kenapaå•¦ Kepala saya sangat sakit
8a1a5631c4fea32fa9a0fbf63b4614b89c8afe1f,åœ¨ä¸‹é›¨å— æ˜¯ å° æ­£åœ¨ä¸‹é›¨,Di hujan? Adalah Untuk  sedang hujan
cbabdaf58509623a605fcfa514a846f6639f3651,ç¾åœ¨æ˜¯å¹¾é»é˜ ç¾åœ¨æ˜¯å››é»é˜,Sekarang adalah jam berapa Sekarang adalah jam empat
a5be7e480b1c79bdf3ade16554e221d4e2cbccb9,ä»–å€‘å®¶æœ‰å¹¾å€‹äºº ä»–å€‘å®¶æœ‰å…­å€‹äºº,Mereka rumahnya ada beberapa orang Mereka rumahnya ada enam orang
530f8704b08613eb77d79afd3fc45aa564a48feb,ä½ æ˜¯å­¸ç”Ÿå— æ˜¯ æˆ‘æ˜¯å­¸ç”Ÿ,Anda adalah mahasiswa? Ya Saya mahasiswa
32f09752174bafeb66f762253f0c52440801ed7a,ä½ æ€éº¼å•¦ æˆ‘çš„çœ¼ç›ç—›,Kau kenapaå•¦ Mata saya sakit
b446e8b326fc18aa43585191d464cb12c9b7c006,åœ¨ä¸‹é›¨å— ä¸ å¤ªé™½å‡ºä¾†äº†,Di bawah hujanå— Tidak  matahari keluarnya
2663da12cf782205b0538a1a5db4ff6dad863708,ç¾åœ¨æ˜¯å¹¾é»é˜ ç¾åœ¨æ˜¯å››é»é˜,Sekarang adalah jam berapa Sekarang adalah jam empat
1ee663eb69beda51c64ed581b43eb44a1f88e40b,ä½ æœ‰å¹¾å€‹å…„å¼Ÿå§Šå¦¹ æˆ‘æœ‰ä¸€å€‹å§Šå§Šå’Œä¸€å€‹å¦¹å¦¹,Kamu ada beberapa saudara saudari Aku punya satu saudara saudari dan satu adik
c69971ad836fdb8b9f47ca26b1d4420bfe6eaffb,é€™å¼µæ¡Œå­å¾ˆé‡å— æ˜¯ å° é€™å¼µæ¡Œå­å¾ˆé‡,meja ini beratkah adalah terhadap meja ini berat
0cc16adcf64775ae7a4fc53fd3bf3c9b590feb6a,åœ¨ä¸‹é›¨å— ä¸ å¤ªé™½å‡ºä¾†äº†,Di bawah hujanå— Tidak  matahari keluarnya
59a52357a040b19f177237292d0f9005ffae0ba4,ä½ å€‘å®¶åœ¨å“ªè£¡ æˆ‘å€‘å®¶åœ¨å±±ä¸Š,Kamu rumah di mana Kami rumah di gunung
24330d93dadc457872126c4ae2d4a91a147c492e,é‚£äº›å­©å­åœ¨ç©è€å— æ˜¯ å° é‚£äº›å­©å­åœ¨ç©è€,Those children are playing? adalah Untuk Those children are playing
4706e79ab25baeefe842d7cbff5c132fc8d4162d,ä½ æœ‰å¹¾å€‹å…„å¼Ÿå§Šå¦¹ æˆ‘æœ‰ä¸€å€‹å“¥å“¥å’Œä¸€å€‹å¼Ÿå¼Ÿ,Kamu ada beberapa saudara perempuan Aku punya seorang kakak dan seorang adik laki-laki
fad97bc0f5b5192ebbd284f846eb3e8a4f6d32de,é€™æ˜¯ä»€éº¼ é€™æ˜¯ç‰›,Ini apa sapi
511bf96f8e7e76b10ca4ca9f5a25e4b9d8556d33,ä»Šå¤©å¤©æ°£å¥½å— ä¸ æ­£åœ¨ä¸‹é›¨,Hari ini cuaca bagus? Tidak. sedang hujan
6fe78eb762c4ffdd536c98a1ac6b623a2a6eab94,ä½ å€‘å®¶åœ¨å“ªè£¡ æˆ‘å€‘å®¶åœ¨å±±ä¸Š,Kamu rumah di mana Kami rumah di gunung
2812f38c1d224ce4370ca4c2affd103034d96201,ä½ å¦¹å¦¹åœ¨ç¡è¦ºå— æ˜¯çš„ å¥¹åœ¨ç¡è¦º,Kamu adik tidur? Ya ya dia tidur
802fe7dead5a75c4f8f9ccaaf59a73a57d78286c,ä½ ä»Šå¤©å¾å“ªè£¡ä¾†çš„ æˆ‘ä»Šå¤©å¾å®¶è£¡ä¾†çš„,Kau hari ini dari mana datang Aku hari ini dari rumahnya datang
bfafebaabae61e076b106661a98274e9fcde76a0,é‚£å€‹å¥³äººæ˜¯èª° å¥¹æ˜¯æˆ‘çš„å§Šå§Š,Wanita itu siapa Dia adalah saudara perempuanku
3036a07aa8c6683f12748a4b2e86e0125e806ee0,ä½ æœƒæ´—è¡£æœå— æœƒ æˆ‘æœƒæ´—è¡£æœ,Kau akan cuci pakaian? Akan Aku akan cuci pakaian
59405775c7451b6a23351b94fd805e123d50fd02,é‚£æ˜¯ä»€éº¼ é‚£æ˜¯å½©è™¹,Itu itu apa pelangi
3b0c40ddadf671cbe9c45dff5f135e62584f7fc1,ä½ æœ‰ä¸€å€‹å¦¹å¦¹å— ä¸ æˆ‘æœ‰äºŒå€‹å¦¹å¦¹,Kamu ada satu adik perempuan? Tidak Aku punya dua adik perempuan
bf5c605aa489f49ca18e939d73ff05a085b1c76c,ä½ çˆ¸çˆ¸åœ¨å“ªè£¡ æˆ‘çˆ¸çˆ¸åœ¨å­¸æ ¡è£¡,Kamu ayah di mana Ayahku di sekolah
e6fcfdc10e2b1375eea9b81fa7a4f60e6ff6014c,é‚£å€‹ç”·äººæ˜¯èª° ä»–æ˜¯æˆ‘çš„è€å¸«,Siapa orang itu adalah Dia guru saya
b9e46e6b990725e46c2b9bf749aa01b74bb63b60,ä½ å€‘å¸¸å¸¸å»æ¢æœ›ç¥–çˆ¶å— å° æˆ‘å€‘å¸¸å¸¸å»æ¢æœ›ç¥–çˆ¶,Kamu sering pergi mengunjungi kakekmu? Untuk Kami sering pergi mengunjungi kakekmu
3cb7ff4729f232ed62f362704fa7fb8a5112ab15,é‚£æ˜¯ä»€éº¼ é‚£æ˜¯æ¨¹,Itu itu apa pohon
d09438245f73e6413f2353b1c59934d4953ebd69,é‚£å¼µæ¤…å­å¾ˆé‡å— ä¸ é‚£å¼µæ¤…å­å¾ˆè¼•,Itu kursi sangat berat? Tidak Itu kursi sangat ringan
46b7552d6f237c17d90310106d4bfe6f954097ef,ä½ æ˜å¤©è¦å»å“ªè£¡ æˆ‘æ˜å¤©è¦å»å±±ä¸Š,Kau besok pergi ke mana Aku besok pergi ke gunung
c67f7b8105ca111bd04afef38b6478652cf6f905,ä½ çš„è²“æ˜¯é»‘è‰²çš„å— æ˜¯ å° æˆ‘çš„çš„è²“æ˜¯é»‘è‰²çš„,Anda kucing adalah hitam warna? adalah Untuk saya kucing adalah hitam warna
92c4be90883908dfd3f76aa1bd9da39fbced73ee,ä»–å€‘å®¶æœ‰å¹¾å€‹äºº ä»–å€‘å®¶æœ‰å››å€‹äºº,Mereka rumahnya ada beberapa orang Mereka rumahnya ada empat orang
1396f3a3f9938d50a1ccbc4b9cc700a3773571e9,ä½ å–œæ­¡è®€æ›¸å— æ˜¯ å° æˆ‘å–œæ­¡è®€æ›¸,Anda suka membaca? Adalah Untuk Saya suka membaca
9cd770643a57635c7a1c6ecf800c16494480451f,ä½ æ™šä¸Šå¹¾é»é˜ç¡è¦º æˆ‘æ™šä¸Šåé»é˜ç¡è¦º,"Kau jam berapa tidur malam, aku jam sepuluh malam tidur"
3007b9bf0569cb3a2a931f6cb4502971e8c26e5b,æˆ‘çš„ç­†åœ¨å“ªè£¡ ä½ çš„ç­†åœ¨é€™è£¡,Pencaku di mana Pencamu di sini
2bd9fc48b04bf6026783ce08db312c6ba00bd4a6,ä½ æ—©ä¸Šå¹¾é»é˜èµ·åºŠ æˆ‘æ—©ä¸Šå…­é»é˜èµ·åºŠ,"Kau jam berapa bangun pagi, aku jam enam pagi."
7d5d37c063085f3b911c6b17da96e30867032ef5,ä»–æ˜¯ä½ çš„è€å¸«å— æ˜¯ å° ä»–æ˜¯æˆ‘çš„è€å¸«,Dia guru kamu? Ya Untuk Dia guru saya
eafb219eeefa6687aea0e8f6e1a28fd861beea0f,ä½ æ€éº¼äº† æˆ‘çš„é ­å¾ˆç—›,Kamu kenapa sudah Kepala saya sangat sakit
7fdbd94e489bff3fb468a6b15be739e9e79bc5a9,é‚£äº›å­©å­æœƒå”±æ­Œå— æ˜¯ ä»–å€‘å¾ˆæœƒå”±æ­Œ,Mereka anak akan bernyanyi? Ya Mereka sangat akan bernyanyi
0eb79f4a92c3ac302f8356f057529efaad92ac46,ä½ æ™šä¸Šå¹¾é»é˜ç¡è¦º æˆ‘æ™šä¸Šåé»é˜ç¡è¦º,"Kau jam berapa tidur malam, aku jam sepuluh malam tidur"
f550b0035505b54ac694ee9c5e6cc39720a33b5c,é€™æ˜¯æˆ‘çš„éŒ¢å— æ˜¯çš„ é€™æ˜¯ä½ çš„éŒ¢,Ini uangku? Ya itu Ini uangmu
c65dc0bf59fcf65eec7c690e551924fd4c653823,ä»–å€‘å¤©å¤©çœ‹é›»è¦–å— æ˜¯ å° ä»–å€‘å¤©å¤©çœ‹é›»è¦–,Mereka tiap hari nonton televisi? adalah Untuk Mereka tiap hari nonton televisi
e3eb281cc6aa339650b0f895f9916c0af922ac73,ä½ å€‘å®¶æœ‰å¹¾å€‹äºº æˆ‘å€‘å®¶æœ‰äº”å€‹äºº,Kalian ada berapa orang rumah Kami ada lima orang rumah
1935bfea0c47484d4bf46ed5c4b233463802a2d2,ä½ å€‘æ˜¨å¤©å»å“ªè£¡ æˆ‘å€‘æ˜¨å¤©å»å±±ä¸Š,Kamu kemarin pergi mana Kami kemarin pergi ke gunung
d54ef8819aa65ca0eed876fbc89cfd6541df07c2,ä»–æ˜¯ä½ çš„è€å¸«å— æ˜¯ ä»–æ˜¯æˆ‘çš„è€å¸«,Dia guru kamu? Ya Dia guru saya
