id,chinese,translation
2e81f5c44788a158bc1157d86b160d405886c3c0,æ‹¿äº”æ ¹é¦™è•‰çµ¦è±¬,Bawa lima biji banana bagi babi
d85cab3894df852a9f9df9f5e2a51453992f39b3,æ‹¿å…­æ ¹é¦™è•‰çµ¦è±¬,Hantar enam biji banana bagi babi
c06b6fa430c2671ce02b2ee6cd4d652d3cc1e6b5,æ‹¿ä¸ƒæ ¹é¦™è•‰çµ¦è±¬,Bawa tujuh biji banana bagi babi
c14158b1e9e59fb8aa2ca9a1a4434fe93460858a,æ‹¿å…«æ ¹é¦™è•‰çµ¦è±¬,Lakukan delapan biji banana bagi babi
fbc69e0d24fa81c21c412b89e2ac95e3d4635c1f,æ‹¿ä¹æ ¹é¦™è•‰çµ¦è±¬,Lakukan sembilan biji banana bagi babi
897aa7d684f51ebbc3dae2016b3a281c8258766c,æ‹¿åæ ¹é¦™è•‰çµ¦è±¬,Lakukan sepuluh biji banana bagi babi
f4a8b6013f81ab933c6158a88e6e1c2ae1130d73,æ‹¿ä¸€æ ¹é¦™è•‰çµ¦ç¾Š,Bawa sepotong banana bagi domba
47c28f4767e6d4a9e99a0caf5471760831a0d066,æ‹¿å…©æ ¹é¦™è•‰çµ¦ç¾Š,Beri dua biji banana bagi domba
fccc7d1dcafbe8ab7eea76340ab288b7358a2c21,æ‹¿ä¸‰æ ¹é¦™è•‰çµ¦ç¾Š,Bawa tiga biji banana bagi domba
b180723cf105fdd9ad83eea996f4defb37678b6c,æ‹¿å››æ ¹é¦™è•‰çµ¦ç¾Š,Bawa empat biji banana bagi domba
bc49478d412a4fdcad842374cda5e1b61d632d76,æ‹¿äº”æ ¹é¦™è•‰çµ¦ç¾Š,Bawa lima biji banana bagi domba
2379b08b2f15eab5262277244c360ec2b787cacb,æ‹¿å…­æ ¹é¦™è•‰çµ¦ç¾Š,Bawa enam biji banana bagi domba
3837c42e0f7c90758f326933901a1db1a8ebc7fe,æ‹¿ä¸ƒæ ¹é¦™è•‰çµ¦ç¾Š,Bawa tujuh biji banana bagi domba
783f467162b3a9685507200dc78b8c02b2c7278c,æ‹¿å…«æ ¹é¦™è•‰çµ¦ç¾Š,Lakukan delapan biji banana bagi domba
230b0c1531e5b2d545f90d7f9a5ca8098481cf84,æ‹¿ä¹æ ¹é¦™è•‰çµ¦ç¾Š,Lakukan sembilan biji banana bagi domba
3c7396227625db69ac9a308cea716e805da6420a,æ‹¿åæ ¹é¦™è•‰çµ¦ç¾Š,Bawa sepuluh biji banana bagi domba
256a1ebbcb8b6de0771d14df2839c9667b8c19dd,å“¥å“¥æœ‰æ©¡çš®æ“¦,Kakak ada kayu kulit sikat
488d56eea2e05ee62b87fc9f6ff5648d5aa87217,å“¥å“¥æœ‰ç­†,Bapak ada pena
b67bafb63815973055f8bd0667cd1547d6967da8,å“¥å“¥æœ‰æ›¸,Kakak ada buku
f30417155552717ec2680c4fa49f1a0cbfc8832e,å“¥å“¥æœ‰å‰ªåˆ€,Kakak punya gunting
98b160ff515b84782f5e683154f22fc3224f14ae,å“¥å“¥æ²’æœ‰æ©¡çš®æ“¦,Kakak tidak rub kulit.
d197b0ebce35ea6509b5537659f18fbd99f56c73,å“¥å“¥æ²’æœ‰ç­†,Kakak tidak punya pen
f03534211f418f98e2c5041bf8f9da41c686b2ab,å“¥å“¥æ²’æœ‰æ›¸,Kakak tidak punya buku
f5adb248c664c432fb6889963422ac81b0cc323e,å“¥å“¥æ²’æœ‰å‰ªåˆ€,Kakak tak punya gunting
298c7361525bf251c8829c7fa1e468fecc7f27f8,å§å§æœ‰æ©¡çš®æ“¦,Saudaraku ada lapur kulit
30569f88ea9251c1f87b2e80de20bc23938ae04a,å§å§æœ‰ç­†,Sisi ada pen
3d9df7c6f05fce8a3272189ce5d60aadbb2697d5,å§å§æœ‰æ›¸,Si kakak ada buku
bdbae91a77fe3a35fb38cdfefa41968801112c71,å§å§æœ‰å‰ªåˆ€,Suster punya gunting
31fa037e04e9dc134b3198918e94cfefb786fe1a,å§å§æ²’æœ‰æ©¡çš®æ“¦,Saudaraku tidak rub kulit.
21079d46494d8eab39331afa9fd00f66923ca7b6,å§å§æ²’æœ‰ç­†,Sister tiada pen
d9552db4ede0e1306365762eefaf87a34d5a1b90,å§å§æ²’æœ‰æ›¸,Sister tiada buku
786bc92be5af76896e0e3382b8105e7fbed975e2,å§å§æ²’æœ‰å‰ªåˆ€,Suster tidak memiliki gunting
521d55164d7b825fa37e473745b3ec30eaa64e9e,å¼Ÿå¼Ÿæœ‰æ©¡çš®æ“¦,Brother has rubber skin
dc101c3d1657534d96fc553dbaaeb4f1749d0083,å¼Ÿå¼Ÿæœ‰ç­†,Brother has pen
5ab72936e894bff55932ee88b6c1aa472b280e92,å¼Ÿå¼Ÿæœ‰æ›¸,Brother has book
f326e44c84916ba90384f38e38375868e3e9f5b3,å¼Ÿå¼Ÿæœ‰å‰ªåˆ€,Kakak saya punya gunting
4733297b24cba8098890a6b421764f41ec05233b,æ‹¿æ©¡çš®æ“¦çµ¦å“¥å“¥,Pakai kulit kayu gosok buat kakakku
32ce89a5e0854e5a7799661a2314929425865dde,æ‹¿æ©¡çš®æ“¦çµ¦å§å§,Pakai kulit karet gosok buat kakaknya
1636453b9dd0dc0de68ee5a2f2c4d99e997e17f6,æ‹¿æ©¡çš®æ“¦çµ¦å¼Ÿå¼Ÿ,Berawa kulit kayu gosok buat adik laki
305de8a39fe506fff365d456d0828435b541656b,æ‹¿æ©¡çš®æ“¦çµ¦å¦¹å¦¹,Lakukan kulit karet untuk adik perempuan
9e733f2dde7922aab2a855effbad0670038f169a,æ‹¿ç­†çµ¦å“¥å“¥,Peni untuk kakakku
f636de2e62936d9ddc9524a1e4cb7be72632c32b,æ‹¿ç­†çµ¦å§å§,Pegang Pen untuk Suster
ed1f2de214bfc022cdd186d2208a050bc50f8549,æ‹¿ç­†çµ¦å¼Ÿå¼Ÿ,Nai pen untuk adik adik
1ec5be8ac88fbd97b82ff2d1a67f2bc7469e6edc,æ‹¿ç­†çµ¦å¦¹å¦¹,Nanya Pencah Bagi adik perempuan
dcdaa8526e394a6c29d41359369181422877fade,æ‹¿æ›¸çµ¦å“¥å“¥,Hantar buku untuk kakakku
a995f7f4deea9748ecfd161f9d4d952a2cd46195,æ‹¿æ›¸çµ¦å§å§,Hantar buku untuk kakak kakak
8b3c99be70ebd1d992b5b25cd15f45aaa2a19c8b,æ‹¿æ›¸çµ¦å¼Ÿå¼Ÿ,Nai buku buat adik adik
fee8b1e19d3e83387e7739fc5f72cc1fc224c962,æ‹¿æ›¸çµ¦å¦¹å¦¹, NAKU HAI DARI SESURI
ec51a34d904a04daffc5885c70f7b672fe84a265,æ‹¿å‰ªåˆ€çµ¦å“¥å“¥,Hantar gunting untuk kakakku
8bf416150f1d0cc088c548f6257afc21f142a347,æ‹¿å‰ªåˆ€çµ¦å§å§,Bawa gunting untuk kakaknya
c1e8d2d4eb44eb72d71bd3143196c20df09ca20a,æ‹¿å‰ªåˆ€çµ¦å¼Ÿå¼Ÿ,Pegang gunting untuk adik laki
736eae5cab336631ea2b2a2a753f5300d896f6ad,æ‹¿å‰ªåˆ€çµ¦å¦¹å¦¹,Pegang gunting untuk adik perempuan
592a736f1670370b3447bc7a6596469455fe55db,å“¥å“¥æœ‰æ©¡çš®æ“¦å—,Bapak ada kayu kulit membersihkan?
592a736f1670370b3447bc7a6596469455fe55db,å“¥å“¥æœ‰æ©¡çš®æ“¦å—,Bapak ada kayu kulit membersihkan?
29b80c291529fdba937181a491b41c845cdffa95,å“¥å“¥æœ‰ç­†å—,Bro ada pen?
29b80c291529fdba937181a491b41c845cdffa95,å“¥å“¥æœ‰ç­†å—,Bro ada pen?
e39b264b38481781d3c5f15bcc0e4ce06ec6cd7a,å“¥å“¥æœ‰æ›¸å—,Bapak ada buku?
e39b264b38481781d3c5f15bcc0e4ce06ec6cd7a,å“¥å“¥æœ‰æ›¸å—,Bapak ada buku?
8f600fbbabe48e43a1fc3cb9ab8d353d8089c70d,å“¥å“¥æœ‰å‰ªåˆ€å—,Kakak punya gunting?
8f600fbbabe48e43a1fc3cb9ab8d353d8089c70d,å“¥å“¥æœ‰å‰ªåˆ€å—,Kakak punya gunting?
6a04e61a1a8139fbb0df1a6c9c9cfc380c1c9364,å§å§æœ‰æ©¡çš®æ“¦å—,Bibi ada lapur kulit?
6a04e61a1a8139fbb0df1a6c9c9cfc380c1c9364,å§å§æœ‰æ©¡çš®æ“¦å—,Bibi ada lapur kulit?
4f333f9d990e08c2425f86c950fe021279a3f4da,å§å§æœ‰ç­†å—,Sister ada pen?
4f333f9d990e08c2425f86c950fe021279a3f4da,å§å§æœ‰ç­†å—,Sister ada pen?
955b3da3939c4372f821330a2b1b8f3dbbff151e,å§å§æœ‰æ›¸å—,Sister ada buku?
955b3da3939c4372f821330a2b1b8f3dbbff151e,å§å§æœ‰æ›¸å—,Sister ada buku?
fb491981467ef842a1b4a8c267ca29d66a8d4a2a,å§å§æœ‰å‰ªåˆ€å—,Saudaraku punya gunting?
fb491981467ef842a1b4a8c267ca29d66a8d4a2a,å§å§æœ‰å‰ªåˆ€å—,Saudaraku punya gunting?
9e55cb5a5928a53cd1c72d989c645cd795d40f65,å¼Ÿå¼Ÿæœ‰æ©¡çš®æ“¦å—,Brother have rubber skin?
9e55cb5a5928a53cd1c72d989c645cd795d40f65,å¼Ÿå¼Ÿæœ‰æ©¡çš®æ“¦å—,Brother have rubber skin?
aebaa0037a8e403e9b5c699120297643b88bcf7c,å¼Ÿå¼Ÿæœ‰ç­†å—,Brother has pen?
aebaa0037a8e403e9b5c699120297643b88bcf7c,å¼Ÿå¼Ÿæœ‰ç­†å—,Brother has pen?
095188aefec73d4372e8f726fe962bb902e6c813,å¼Ÿå¼Ÿæœ‰æ›¸å—,Brother have book?
095188aefec73d4372e8f726fe962bb902e6c813,å¼Ÿå¼Ÿæœ‰æ›¸å—,Brother have book?
a1d1d519b0975f90f2f941f0588341ddbdaf6618,å¼Ÿå¼Ÿæœ‰å‰ªåˆ€å—,Bapaknya punya gunting?
a1d1d519b0975f90f2f941f0588341ddbdaf6618,å¼Ÿå¼Ÿæœ‰å‰ªåˆ€å—,Bapaknya punya gunting?
ba3b3c70ed283d8c9cf03f4594a246e43c7a04a0,å¦¹å¦¹æœ‰æ©¡çš®æ“¦å—,å¦¹æœ‰æ©¡çš®æ“¦å—
ba3b3c70ed283d8c9cf03f4594a246e43c7a04a0,å¦¹å¦¹æœ‰æ©¡çš®æ“¦å—,å¦¹æœ‰æ©¡çš®æ“¦å—
2d9f895ee34e6fbfb090067b8549d0f077774248,å¦¹å¦¹æœ‰ç­†å—,å¦¹æœ‰ç­†å—
d3e8315e583d784330506b2f4bab6b2b0f98c1c9,æ‹¿ç´…è‰²æ©¡çš®æ“¦çµ¦å“¥å“¥,Pakai kulit kayu merah gosok buat kakakku
4b48da06c6c50570fd3c85b71a326667fc759260,æ‹¿ç¶ è‰²æ©¡çš®æ“¦çµ¦å“¥å“¥,Pakai kulit kayu hijau gosok buat kakakku
98e67072c7c1d70b254ea8be560f15924e9cd14f,æ‹¿é»‘è‰²æ©¡çš®æ“¦çµ¦å“¥å“¥,Pakai kulit kayu hitam gosok buat kakakku
460e8ab91751ed42851dae8c8e26c41ccc625bb3,æ‹¿é»ƒè‰²æ©¡çš®æ“¦çµ¦å“¥å“¥,Pakai kulit kayu kuning gosok buat kakakku
17708485385779f171720b51900870e19b265308,æ‹¿ç´…è‰²ç­†çµ¦å“¥å“¥,Hantar pena merah ke kakakku
f7d72eadce5ae902fba109d6756cfcc7f7262eb7,æ‹¿ç¶ è‰²ç­†çµ¦å“¥å“¥,Pegang pena hijau untuk kakakku
01f8365aeaf7ca172fd1387544918b5762e28cae,æ‹¿é»‘è‰²ç­†çµ¦å“¥å“¥,Neri Black Pen untuk kakakku
dcd044d834417d7d5b4d82acbe06bebb0f1dcf4e,æ‹¿é»ƒè‰²ç­†çµ¦å“¥å“¥,Hantar pena kuning ke kakakku
ae5f724932022db6614aa8e5d0c54de31d81d819,æ‹¿ç´…è‰²æ›¸çµ¦å“¥å“¥,Hantar buku merah ke kakakku
8a2f8f544f8a98f63a1ac36802b1aab8e4866bfb,æ‹¿ç¶ è‰²æ›¸çµ¦å“¥å“¥,Bawa buku hijau ke kakakku
b8cb2fff21eead31a94263413e5346a3cd651051,æ‹¿é»‘è‰²æ›¸çµ¦å“¥å“¥,Noa buku hitam buat kakakku
32694eb0a78cc95cd53cbfabc8f26b19415e7075,æ‹¿é»ƒè‰²æ›¸çµ¦å“¥å“¥,Hantar buku kuning ke kakakku
441d13ec82346a2071f5b44e7e69e8e75909f6dd,æ‹¿ç´…è‰²å‰ªåˆ€çµ¦å“¥å“¥,Bawa gunting merah untuk kakakku
de548aca71605d17b5f36cc24f5eaff28a87156a,æ‹¿ç¶ è‰²å‰ªåˆ€çµ¦å“¥å“¥,Bawa gunting hijau untuk kakakku
a1ac07f27f55eafe8eac135586163e04ad279f43,æ‹¿é»‘è‰²å‰ªåˆ€çµ¦å“¥å“¥,Hantar gunting hitam untuk kakak
c26fc25046fab6e8bac38ac4171cd3e72510a009,æ‹¿é»ƒè‰²å‰ªåˆ€çµ¦å“¥å“¥,Bawa gunting kuning untuk kakakku
abdc341813560d701706879f04e45686a859432c,æ‹¿ç´…è‰²æ©¡çš®æ“¦çµ¦å§å§,Lakukan kulit kayu merah mengusap buat adik perempuan
5bd4c5a43e11548d3167a7fbb92478559577ca2f,æ‹¿ç¶ è‰²æ©¡çš®æ“¦çµ¦å§å§,Pakai kulit kayu hijau gosok buat kakak
3ba49100464178d5a0a84d05f780552a5c918584,ç”·äººæœ‰å¸½å­å—,Laki-laki ada topi?
3ba49100464178d5a0a84d05f780552a5c918584,ç”·äººæœ‰å¸½å­å—,Laki-laki ada topi?
449870c5f185cbf4759baf2334346f36754a0977,å¥³äººæœ‰å¸½å­å—,Wanita punya topi?
449870c5f185cbf4759baf2334346f36754a0977,å¥³äººæœ‰å¸½å­å—,Wanita punya topi?
40f97411988a6262df1eed9757dff15a51a3b150,ç”·å­©æœ‰å¸½å­å—,Anak laki-laki ada topi?
40f97411988a6262df1eed9757dff15a51a3b150,ç”·å­©æœ‰å¸½å­å—,Anak laki-laki ada topi?
ec45e884082b78731fcf6859cf311df7c2033f68,å¥³å­©æœ‰å¸½å­å—,Gadis punya topi?
ec45e884082b78731fcf6859cf311df7c2033f68,å¥³å­©æœ‰å¸½å­å—,Gadis punya topi?
a2408673f31e9e501ea470e73b75a9672c0c3b8a,ç”·äººæœ‰åŒ…åŒ…å—,Punya pria tas tas?
a2408673f31e9e501ea470e73b75a9672c0c3b8a,ç”·äººæœ‰åŒ…åŒ…å—,Punya pria tas tas?
b0f71766d3b1dfb88596fe0f0d8b1e4e065eb8c7,å¥³äººæœ‰åŒ…åŒ…å—,Wanita ada tas tas?
b0f71766d3b1dfb88596fe0f0d8b1e4e065eb8c7,å¥³äººæœ‰åŒ…åŒ…å—,Wanita ada tas tas?
5a279aefd2567c2a4b027aa46fd478009583bd0c,ç”·å­©æœ‰åŒ…åŒ…å—,Anak laki-laki ada bag bag?
5a279aefd2567c2a4b027aa46fd478009583bd0c,ç”·å­©æœ‰åŒ…åŒ…å—,Anak laki-laki ada bag bag?
97648b2f9b16829aea5224480fc5a8a2e4d30e6a,å¥³å­©æœ‰åŒ…åŒ…å—,Gadis ada tas tas?
97648b2f9b16829aea5224480fc5a8a2e4d30e6a,å¥³å­©æœ‰åŒ…åŒ…å—,Gadis ada tas tas?
0193d240a204b20adeb270329d1325ce001c79d4,ç”·äººæœ‰æ‰‹éŒ¶å—,Men have handwatch?
0193d240a204b20adeb270329d1325ce001c79d4,ç”·äººæœ‰æ‰‹éŒ¶å—,Men have handwatch?
6ed7e703856fc8fb62295d3050be5de763238811,å¥³äººæœ‰æ‰‹éŒ¶å—,Wanita ada jam tangan?
6ed7e703856fc8fb62295d3050be5de763238811,å¥³äººæœ‰æ‰‹éŒ¶å—,Wanita ada jam tangan?
2837ddaf53a7f57d18efc1463f19cb8a4aa5fc04,ç”·å­©æœ‰æ‰‹éŒ¶å—,Anak laki-laki ada jam tangan?
2837ddaf53a7f57d18efc1463f19cb8a4aa5fc04,ç”·å­©æœ‰æ‰‹éŒ¶å—,Anak laki-laki ada jam tangan?
5a3e2929f3d191ce0dbaddc3787ea4a83bcdbad9,å¥³å­©æœ‰æ‰‹éŒ¶å—,Gadis punya jam tangan?
5a3e2929f3d191ce0dbaddc3787ea4a83bcdbad9,å¥³å­©æœ‰æ‰‹éŒ¶å—,Gadis punya jam tangan?
27a48f5b1585aa561bfbbf2aeb7feade70500e17,ç”·äººæœ‰é›¨å‚˜å—,Laki-laki punya payung hujan?
27a48f5b1585aa561bfbbf2aeb7feade70500e17,ç”·äººæœ‰é›¨å‚˜å—,Laki-laki punya payung hujan?
d7aa010bd7be5b9316d6b7c1bea7cb9d51cc95a6,å¥³äººæœ‰é›¨å‚˜å—,Wanita punya payung hujan?
d7aa010bd7be5b9316d6b7c1bea7cb9d51cc95a6,å¥³äººæœ‰é›¨å‚˜å—,Wanita punya payung hujan?
b55feb215a1c58578e872a4ee153186ca566b128,ç”·å­©æœ‰é›¨å‚˜å—,Anak laki-laki punya payung hujan?
3b6d82308c0bf944fd1505517eaa811cb1cd8232,ç”·äººæœ‰å¸½å­,Pria punya topi
88bf2162c4c67470d93d2301391298cd5ae439f8,ç”·äººæ²’æœ‰å¸½å­,Pria Tidak Topi
3bbe5c05fc6410aed21faf030dd7ab60522bd53a,å¥³äººæœ‰å¸½å­,Wanita punya topi
371a91a771af0e326fd9d8f27cc8b65ada75a295,å¥³äººæ²’æœ‰å¸½å­,Wanita Tidak Topi
8452fb28a810e742c68d55f07f85ee758980a774,ç”·å­©æœ‰å¸½å­,Anak laki-laki memiliki topi
47aea6410daa8b0352a6515fcdcd171d19ec84b9,ç”·å­©æ²’æœ‰å¸½å­,Anak laki-laki tidak topi
310fda31612f97cb0a8bb5f505f9ad0e72789fdd,å¥³å­©æœ‰å¸½å­,Gadis punya topi
d3354a9c842aeb29a018b7cb324972a96862fef6,å¥³å­©æ²’æœ‰å¸½å­,Gadis tidak topi
3e8fa92f407e8f05b6cae5dac29c300348f67e26,ç”·äººæœ‰åŒ…åŒ…,Pria ada tas tas
281de64f8dafac5d297b88686198b614d976b358,ç”·äººæ²’æœ‰åŒ…åŒ…,Pria tidak bagasi
71536a32f792afd6ca089ddad0f34f54909e190f,å¥³äººæœ‰åŒ…åŒ…,Wanita ada tas tas
79ef370e6a4d814f0fa7d58ce3d29ce28bb539f8,å¥³äººæ²’æœ‰åŒ…åŒ…,Wanita tidak tas tas
346da7f7927e1f31794d63f1609310b16e805608,ç”·å­©æœ‰åŒ…åŒ…,Anak laki-laki ada tas tas
c023e9c1a42e1692091658406431fc43c9498529,ç”·å­©æ²’æœ‰åŒ…åŒ…,Anak laki-laki tidak tas tas
4e6e8305ed20bde30ab8666412983049ccbb0674,å¥³å­©æœ‰åŒ…åŒ…,Gadis ada tas tas
7c4030d383f1821c9251311f1b01cacc8e01d7c4,å¥³å­©æ²’æœ‰åŒ…åŒ…,Gadis tidak punya tas
cb240b39fb45fcbafde7ae5a977dcc2a54a05027,ç”·äººæœ‰æ‰‹éŒ¶,Pria punya jam tangan
53d2bf81f6ccd1a2c1a51665fb980ac961690f76,ç”·äººæ²’æœ‰æ‰‹éŒ¶,Pria tidak memiliki handphone
1940ea051a20fd026e07c08aeaf57e8416417c5d,å¥³äººæœ‰æ‰‹éŒ¶,Wanita punya jam tangan
1389eff9103070c617a054910b33e6fd4294f80d,å¥³äººæ²’æœ‰æ‰‹éŒ¶,Wanita Tidak Pakai Jam Tangan
736e32f6cd3f6e41be08a319331d4fe42de67cc4,ç”·äºº,Pria
bfbccb88f7c0436d2a22d78291bb7b2121efc238,å¥³äºº,Wanita
56e7410ea1920cce06121b2c0f5ccae08bd0d8fc,ç”·å­©,Anak laki-laki
10e5b87cbdd94cad16100c952d0aecedafda1bc3,å¸½å­,Topi
98c5951ce3e7949cb3effbcd1ecd96380b084ab9,åŒ…åŒ…,Paket
21b69dd8a19c124cad43f8218a2f0b78b7f2d7f6,æ‰‹éŒ¶,Handphone
2ed21ea6c32ed6d807acf128e07cd2e51c7c93b2,é›¨å‚˜,Payung hujan
2f9d0922e99e80290036ae690dced08bd1c0c4b9,å¥½çœ‹çš„,Bagus lihat
c59b8a09069867149923fa0e76bff31efdee6fb1,ä¸å¥½çœ‹çš„,Tidak menonjol
d1c3237ef25882ae44c4061aafb332c2d83f1da3,æ–°çš„,Baru
1bb694adbda449bf19e420fb16271420bd6c422b,èˆŠçš„, lama
bf14f6ce4639e414d37b9737fbcb458d575085b1,å£æ‰, rusak
cd820bc3469099325f2cdb39b30cca7411f46917,ç”·äººçš„å¸½å­å¾ˆå¥½çœ‹,Topi pria itu bagus lihat
556138bf56cbc4daeb79a89a2e447989242e249b,ç”·äººçš„å¸½å­ä¸å¥½çœ‹,Topi pria tidak terlihat
3b11b55cddb8d45beea5ed7cebb6a82913356e4f,ç”·äººçš„å¸½å­æ˜¯æ–°çš„,Topi pria adalah baru
80e00aaac7afe41b0afb5e43767272a5f34ea42f,ç”·äººçš„å¸½å­æ˜¯èˆŠçš„,Topi pria adalah lama
fec0d5b42ec280732722a85e4e4dae8d17a13feb,ç”·äººçš„å¸½å­å£æ‰äº†,Topi pria itu rusak jatuh
e105de991a441b026410641d75b6a47b138b723a,å¥³äººçš„åŒ…åŒ…å¾ˆå¥½çœ‹,Tas tas wanita bagus lihat
522b406c2b6df9e10148bc2249baf4dad81fe249,å¥³äººçš„åŒ…åŒ…ä¸å¥½çœ‹,Tas tas wanita tidak terlihat bagus
22089ab7fa021f27658183eaa6c3b17491518279,å¥³äººçš„åŒ…åŒ…æ˜¯æ–°çš„,Tas tas wanita adalah baru
7433685896cb1c55c5e694b34db2db5ef3100880,å¥³äººçš„åŒ…åŒ…æ˜¯èˆŠçš„,Tas tas wanita adalah lama
32e894a602831f1e23641261358354aa2f7af866,å¥³äººçš„åŒ…åŒ…å£æ‰äº†,Tas tas wanita itu rusak keluar
aca71e019f421c37de274cf474e01b96c3446500,ç”·å­©çš„æ‰‹éŒ¶å¾ˆå¥½çœ‹,Jam tangan anak laki-laki bagus terlihat
8d2a8e84842287a98b4f523b91834f78eb418f14,ç”·å­©çš„æ‰‹éŒ¶ä¸å¥½çœ‹,Jam tangan anak laki-laki tidak terlihat
a9b92a35b808d21a93be3f7b6d15d53551e088a1,ç”·å­©çš„æ‰‹éŒ¶æ˜¯æ–°çš„,Jam tangan anak laki-laki adalah baru
0decd1298ab731cc7c435599906e1da3b393e029,ç”·å­©çš„æ‰‹éŒ¶æ˜¯èˆŠçš„,Jam tangan anak laki-laki adalah lama
ea2bd65a2380856eea28e1e309565906add15c7b,ç”·å­©çš„æ‰‹éŒ¶å£æ‰äº†,Jam tangan anak laki-laki rusak jatuh
f8f74a8985a8e9db553a3d6847b30676d7d71bfb,å¥³å­©çš„é›¨å‚˜å¾ˆå¥½çœ‹,Payung hujan gadisnya bagus lihat
d8f7cc38c0b59d078316632c5e6e3de8dc70f510,å¥³å­©çš„é›¨å‚˜ä¸å¥½çœ‹,Payung hujan gadisnya tidak terlihat
09599616c1dcfddfbb5ef296c6d99224d6cb9a86,å¥³å­©çš„é›¨å‚˜æ˜¯æ–°çš„,Payung hujan gadis adalah baru
2b0424a431d1fdb56fbf96bc42e58543f9d213f8,å¥³å­©çš„é›¨å‚˜æ˜¯èˆŠçš„,Payung hujan gadisnya adalah lama
a455cb82184602443db96a57f9f7a5accb1d3fd8,è½èµ·ä¾†å¾ˆå¥½ç© æˆ‘ä¹Ÿå¯ä»¥ä¸€èµ·å»å—, terdengar bagus fun Aku juga bisa ikut?
84dbbae82cbd85e452b16c801d063fe1bfd862d5,ä½ å…ˆå•åª½åª½,Anda tanya ibu dulu
8ba465a542cb10248a5c4788d242b81694903c8b,åª½åª½ æˆ‘å¯ä»¥è·Ÿå“¥å“¥ä¸€èµ·å»æºªé‚Šå—," Ibu, aku bisa bersama kakakku pergi ke sungai pinggir?"
f7d1c015aab3ae8fd874a376f6d77ed3e54b103f,å¯ä»¥ ä½†ä½ å€‘è¦å°å¿ƒå–”,Tapi bisa kalian harus hati-hatiå–”
68a76dfb7b354d3c11553aaed907457c3dbc1363,æ²’å•é¡Œ æˆ‘å€‘ä¸€å®šæœƒçš„,æ²’å•é¡Œ æˆ‘å€‘ä¸€å®šæœƒçš„
8ecb860de3ff72a4d9d77be8e796696be9824f9b,ä½ è¦æ‰¾ä»€éº¼,Kamu mau cari apa
fd5eac268da5136f4799b1c186d3dadad50b15eb,æºªé‚Šè¦å¾€å“ªè£¡èµ°,æºªé‚Šè¦å¾€å“ªè£¡å»
5d95e6529d54ff9d9fe43d8b45b6b1e367377bfd,å¯ä»¥å€Ÿæˆ‘åˆ€å­å—,Boleh pinjam pisau saya?
acd0343356d95622ed4ac3e666cc16f7d067914e,ä»€éº¼,ä»€éº¼
18c59b51c25da743effd577c296b93200364b521,æˆ‘å»æ‰¾æœ¨ç‚­å’Œçƒ¤è‚‰ç¶²,Saya pergi mencari arang dan barbecue net
cf6e67c3899c2d9b2223deb3a4f81b3a88dff97d,é‚£é‚Š æœ‰é¡†å¤§çŸ³é ­é‚£é‚Š,Di sebelah itu ada batu besar di sebelah itu
37a186fc4dfaf904b5e34eda784d903eb6e6e718,å¥½å•Š æ‹¿å»,"Baik ah, ambillah"
52656481e3624be3e319d7d4305b2a850f70eb2f,è½ä¸æ‡‚, Dengar tidak
fe4e0155d7c600fb7aa850bcb903f66701cb315b,æˆ‘å»æ‰¾ç‰ç±³å’Œåœ°ç“œ,Saya pergi mencari jagung dan melaka
da756179f45b106864df8c9b82522867c2512952,æˆ‘ä¸çŸ¥é“æºªé‚Šåœ¨å“ªè£¡,Saya tidak tahu sungai dimana di mana
d117244f8fcda60a9c7cbe9f27cc2d14effe4394,æˆ‘ä¹Ÿæ²’æœ‰,Saya juga tidak
1c613d0f757d417e48a278ca836c10c68dc24148,ä¸çŸ¥é“,Tidak tahu
a95674b214e55957fdd6680cd5e0cee5d664f9a9,é€™é‚Š æˆ‘å‰›å¾æºªé‚Šå›ä¾†,Ini saya baru dari sungai balik
bcbcabe0f33415f91ab234d8f12db89718bb029f,æ‹¿å¸½å­çµ¦ç”·äºº,Bawa topi untuk pria
a9259911f9b33c46af04f4b3cc46b6f5047cb3ac,æ‹¿å¸½å­çµ¦å¥³äºº,Bawa topi untuk wanita
68b1c94e2f68a6240ba90e1eac2d6a2afd70f763,æ‹¿å¸½å­çµ¦ç”·å­©,Bawa topi untuk anak laki-laki
3cc6014822557d2f6036dd8f3568d3859d8edcc4,æ‹¿å¸½å­çµ¦å¥³å­©,Bawa topi untuk gadis
d15a58b3d94ea22bcca329daa3ce96c8ad6ddfd8,æ‹¿é›¨å‚˜çµ¦ç”·äºº,Bawa payung untuk pria
5415f1f171e1b36815bc8b5a62f8c585873eb5cd,æ‹¿é›¨å‚˜çµ¦å¥³äºº,Bawa payung untuk wanita
51378507ac71fc19f28743163a6168ae5956533d,æ‹¿é›¨å‚˜çµ¦ç”·å­©,Bawa payung untuk anak laki-laki
54be638b53783369a78d1c2e039f08fc94528f6b,æ‹¿é›¨å‚˜çµ¦å¥³å­©,Bawa payung untuk gadis
7fe862d259e45e27d8f1c6ab4445c55c82d345f0,æ‹¿åŒ…åŒ…çµ¦ç”·äºº,Bawa tas bagikan pria
4715d3ef11d97711aea1695159100b7136c1b1c2,æ‹¿åŒ…åŒ…çµ¦å¥³äºº,Pegang tas bagikan wanita
0f8e0a897c1d7473e83e880f88a5c670728f36bb,æ‹¿åŒ…åŒ…çµ¦ç”·å­©,Bawa paket bagikan anak laki-laki
9dcbe2eb8e15d516dc2d646913823cd4280b1d7d,æ‹¿åŒ…åŒ…çµ¦å¥³å­©,Bawa paket bagikan gadis
448987c43117f84dde5b3dbb540094bf0eee8d62,æ‹¿æ‰‹éŒ¶çµ¦ç”·äºº,Hantar jam tangan ke pria
4a0aad9e0eb320230fc4c0299213fd5dce61c62f,æ‹¿æ‰‹éŒ¶çµ¦å¥³äºº,Hantar jam tangan kepada wanita
d8e55baf002a067b8c909c609662461b6120ce02,æ‹¿æ‰‹éŒ¶çµ¦ç”·å­©,Hantar jam tangan ke anak laki-laki
25a6b3074085d0196d8af9301ae5ec613399825d,æ‹¿æ‰‹éŒ¶çµ¦å¥³å­©,Hantar jam tangan ke gadis
a58f17610e114a8a6a2cfff200b22f701b6d3b1e,åª½åª½ä»Šå¤©å®¶è£¡ä¾†äº†å¥½å¤šè¦ªæˆšå“¦,åª½åª½ä»Šå¤©å®¶é‡Œæ¥äº†å¥½å¤šäº²æˆšå“¦
2018c90334d9476ecbb18529428e80fd10b96c1c,ä»Šå¤©æ˜¯å“¥å“¥çš„å©šç¦® æ‰€ä»¥æœ‰å¾ˆå¤šäººä¾†,Hari ini adalah pernikahan kakakku jadi banyak orang datang
7867c0e927185c784d2880da383c4707479fb935,å¥½é–‹å¿ƒå–” å¾ˆä¹…æ²’æœ‰çœ‹åˆ°ä»–å€‘äº†,Baik senangå–” Sudah lama tidak melihat mereka.
78760c1ce0f0cfe6560ff5d34c334ca16d5560af,å°å•Š ä»Šå¤©å¤§å®¶éƒ½æœƒå¾ˆå¿™ ä½ è¦å¹«å¿™å¤§å®¶,"Hmm, hari ini semua orang akan sangat sibuk. Kamu harus bantu semua orang"
fbeb12c29f222934eea2c6d262409a3d4d278c1d,å¥½çš„ æˆ‘ä¸€å®šæœƒ, Baik Saya pasti akan
d075bc05260494bc613d0bbbf0370a05d92c347b,æˆ‘è¦å»æº–å‚™ç­‰ä¸€ä¸‹è¦ç”¨çš„æ±è¥¿äº†,Saya akan pergi siap tunggu saja barang yang akan digunakan sudah
054372462319e5f5d619eebc304f2e8a9cb38af0,æˆ‘ä¾†å¹«å¿™,Saya datang bantu
584ec3ca5790a722e4d5639c1a384fcf67eca283,å¥½ ä½ è·Ÿæˆ‘ä¾†,Baik kau ikut aku
6c07eee0acf2f618b7721420762732a646d61bef,æ–°çš„é™¶å£ºé•·æ€æ¨£,Bagaimana vas ceramik yang baru panjang
f5ac1553ab9fd3f137bbbea93031d938136fd959,å“ªè£¡æœ‰æœˆæ¡ƒ,å“ªé‡Œæœ‰æœˆæ¡ƒ
8272c34bc82927286ca5fed554d143fba6bd5572,ä½ æœ‰çœ‹åˆ°æª³æ¦”å—,Anda ada melihat æ¦”å—
1013f29b44cb2d9825d1ae364c743606aa77f3fe,å“¥å“¥åœ¨å“ªè£¡,Kakak di mana
d160ab16328935c76fde810364a4d0d5a00653e6,ä»€éº¼,ä»€éº¼
6e6c0e3e5c3b862831be9ba4b24987570ed83ce8,æˆ‘æœ‰ç”¨å¸ƒåŒ…èµ·ä¾†,Saya ada pakai kain bungkus
ddf78b1e020bfc6947726895fb77f0c2515a068d,æˆ‘ä¹Ÿä¸çŸ¥é“,Saya juga tidak tahu
e4a268af734e824e387b78fc29245c8508c9ef73,æˆ‘é€™é‚Šæ²’æœ‰,Saya ini sisi tidak
18654ddac3ff0a2a3a1ff58760fd4090f146697a,æ²’çœ‹åˆ° ä»–å»å“ªäº†,æ²’çœ‹åˆ°ä»–å»å“ªäº†
dcc6db3437b5c945afe0a29b6eb6765d163b14a7,è½ä¸æ‡‚, Dengar tidak
8826c263c1ccd99f43ca3f0e13aeb2503070f765,åª½åª½æœ‰ç”¨ç´…å¸ƒåŒ…èµ·ä¾†,Ibu ada gunanya kain merah bungkus
6ba4b28a72b886ca2d3e6054840da7aad9af542d,å±±ä¸Šæ‰æœ‰,Gunung saja ada
57d15c367c0329a2cdb0edee5a7fbdcc8c97a394,ä½ å«ç”šéº¼åå­—,Kau panggil apa nama
78a01b68401c4a1ea97d47b669841cb5cecd7e2f,ä½ çš„å®¶åœ¨å“ªè£¡,Rumahmu di mana
735e7e038dfdd4da400d466ceb8a3687ec1fe570,æˆ‘å¾å®‰é€šéƒ¨è½ä¾†,Saya dari suku An Tun
2561d813a2701f6913ff70394670f7f2d203ffd2,ä½ åƒæ—©é¤äº†å—,Anda makan sarapan sudah?
f533cfba725820f251d79143b2fabf7f5e29e33b,é‚„æ²’è€¶,é‚„æ²’è€¶
01abf431c56957312a39a5f31403b6a687316f0b,æˆ‘è¦å»è²·æ—©é¤ è¦ä¸€èµ·å»å—,Saya pergi beli sarapan Mau bersama pergi?
c70b5dcb77f018a401b490716ecb1443f9a397ff,æˆ‘æ²’æœ‰å¸¶éŒ¢ ä½ å¯ä»¥å€Ÿæˆ‘éŒ¢å—,Saya tidak bawa uang Dapatkah Anda meminjam saya uang?
