id,chinese,translation
1a3c0b85e8c2ed4194e29d613141c0f5b0c9f3ec,æˆ‘è¦å»æ¢æœ›çˆ¶æ¯,Saya mau mengunjungi orang tua
f2eb4d3b96e03901c82b601f488c7ba232322353,ä»–å€‘éƒ½é‚„å¥½å—,Mereka semua masih baik?
bc9f20e58aa94d8d6325cd44ed4d4ef2eb22ea5e,é‚„å¥½å•¦,é‚„å¥½å•¦
8df51c6d4f6053777785b98bab38c545beaf3fc4,å¦³ç¾åœ¨åšä»€éº¼äº‹,å¦³ç¾åœ¨åšä»€éº¼äº‹
9a3c0396a40e6ebfd634e2239c5b1f7e58ef3418,æ²’åšä»€éº¼å‘€ æˆ‘éƒ½åœ¨å®¶è£¡,æ²’åšä»€éº¼å‘€ Saya semua di rumahè£¡
ddfb6a7ea1cab73e75f000112b1bed1047ff7770,æ˜å¤©æœ‰ç©ºå—,Ada kosong besok?
2f28634fc8c38fe8e1852be20480a624fd13a2c6,æœ‰å•Š å¹¹å˜›,Ada ah å¹¹å˜›
4b4c349f952957316401546707b56988c39f218e,ä¸€èµ·åƒå€‹ä¸­é¤å§,Bersama makan sebuah makanan Cina
c9065ecfe9e32017668e49e935fa5051091be7df,å¥½å•Š é‚£éº¼æˆ‘å€‘çš„åœ°é»å‘¢,"Baikah. Nah, dimana tempat kita?"
bd56d822d0afae95f7e644e57443db43b5bcfa90,åœ¨æˆ‘å®¶,Di rumahku
3cd4b24741b25eab2d20fa893412dc7f45b0b6c9,å¥½ å¯ä»¥,Baik boleh
2ea9da77f7258db51a1a78c9074bf6fc170b3231,ä½ å¥½ è«‹å•ä½ å«ä»€éº¼åå­—,Anda silakan tanyakan Anda namanya apa
470c24b536d3bd69ed1fa30ccee9a99e87f1790f,é‚£ä½æ˜¯èª°,Siapa itu orangnya?
bc6d1aa3560c56b5d9668ff65bce158fb39946bf,ä»–æ˜¯æ‰“å¾å“ªè£¡ä¾†çš„,Dia dari mana datang?
85353ef99759cc11266bf744bb6958a9bf41abc0,å¾æ—¥æœ¬ä¾† ä¾†å­¸é˜¿ç¾èª,Dari Jepang datang belajar bahasa Arame
cbb9a655c2a853cc52b2a756ed7515ec4fbb28f5,é‚£ä½åˆæ˜¯èª°,Siapa itu lagi?
3a43ac343a02fe4c359f55c010b6e6dea644be07,å¦³æ˜¯å¾äº‹ä»€éº¼å·¥ä½œ,å¦³æ˜¯å¾äº‹ä»€éº¼å·¥ä½œ
eec990252c479842990b3c53b2b53e2882202b62,æˆ‘æ˜¯è€å¸«,Saya guru
e9c58b56db904db68df00a4766098f6d68b301be,å¦³æ˜¯æ•™ä»€éº¼çš„,å¦³æ˜¯æ•™ä»€éº¼çš„
adcc725af71a8931046f4a5a22d5b0246ca271ad,é˜¿ç¾èª,Arameik
7f7b2f0d6f4ada0227a835318205fc29d000a849,åª½åª½ æˆ‘è‚šå­é¤“,åª½åª½ æˆ‘è‚šå­é¤“
314224128b3f8cdd7baf35c58cbd463d0ef2a782,å‰›åƒéåˆé¤å°±è‚šå­é¤“å•¦,"Baru makan siang habis, perutnya lapar lah."
af2b07e64411816bca3c439d68ca2163578ba1b1,æˆ‘å€‘æ²’åƒåˆé¤,Kami nggak makan siang
539ba9c2a48fb73f6dd598062b288932c023e972,ç‚ºä»€éº¼ä½ å€‘æ²’åƒåˆé¤,Mengapa kalian nggak makan siang
c510392cd3bdf9864dbeee9f173a2c2b143bd1a4,è€å¸«ä¸è®“æˆ‘å€‘åƒåˆé¤,Guru tidak membiarkan kita makan siang
cee59e19fbebbcabbe9eb618fdb8c30bbc4e2ba2,ç‚ºä»€éº¼è€å¸«ä¸è®“ä½ å€‘åƒåˆé¤,Mengapa guru tidak membiarkan kalian makan siang
c75886905b37fe9718f16f4be6d80e08888e6ddf,æˆ‘å€‘è¢«è€å¸«ç½°ç«™,Kami Dipenjara Guru
ba47080e35a3cc9ba8b60f3ce697256751058ad1,ä½ å€‘ç©¶ç«Ÿåšäº†ä»€éº¼,Kamu sebenarnya melakukan apa
c3b40963fab04be3276064bb9398579d8317f88b,æˆ‘å€‘å»æ²³é‚Šæ¸¸æ³³,Kita pergi sungai tepi berenang
3be59b6ccaf491a1733e643d860fae9044c9b508,æ´»è©², Hidupnya
6d1640339732168498ffe04626e685d997037afb,ä»Šå¤©å¤©æ°£æ€éº¼æ¨£,Bagaimana cuaca hari ini
f5eb3fa1f3cc7bed58c81c9cb8ecd51221571cdd,ä»Šå¤©å¤©æ™´,Hari ini cerah
4d30c7be68384931e26afde125e4617d3f70dac2,æ“šé›»è¦–å ±å°æ˜å¤©æœ‰é¢±é¢¨,Dikatakan televisi ada badai besok
4093ca86a47907ec3dfac52a14ec4f6d468b853c,å¦‚æœæœ‰é¢±é¢¨ é‚£å¥½å•Š,Jika ada topan Itu baik ah
5935153c41d0f9c59533734692553e4104ad5698,æœ‰ä»€éº¼å¥½çš„,Ada apa baik
52c1694c1f6cacd6d5c50486f89e7c8c6da6bc1c,å¦‚æœæœ‰é¢±é¢¨ æ²³è£¡å°±æœ‰å¾ˆå¤šé­š,Jika ada topan sungai itu banyak ikan
723bd7aca6fd854a7d3a16c2537c99cea6199e74,ä½ å€‘è¦å¦‚ä½•æ•é­š,Bagaimana kalian akan menangkap ikan
091ca2209edaaceb07c0268d6b03413d10ced911,ç”¨å…«æ›ç¶²æˆ–ç”¨ç¶²å­æŠ“,Dengan delapan gantungan jaring atau dengan jaring pegang
8bbf78ff3b8f3943ace5cac990967c15dedafad7,å¯ç¶²åˆ°ä»€éº¼æ¨£çš„é­š,Apa jenis ikan yang bisa ke jaring
86e3218b36c09c5ad215e905644bad2e5fc875a8,æœ‰å°çƒé­š å¤§çƒé­š é¯½é­š ä¹Ÿæœ‰é»å£é­šå’Œç¾…æ¼¢é­š,Ada ikan kecil U U U ikan Besar U ikan Laki ikan juga ada ikané»å£ dan ikan ç¾…æ¼¢
3a94b37be19b73b7913d0214c22c2fdc643546fa,ä½ æ˜¯å“ªä¸€å¹´å‡ºç”Ÿçš„,Anda lahir pada tahun mana
ba124ef1728f8448f2b125d206bb5f76defa42b6,ä½ åœ¨å¤å¤©ç”Ÿçš„å—,Kau di musim panas lahirkah
861f1948f8c326ba8c593a26a995c0cfbfa9bfc9,ä¸æ˜¯ åœ¨å†¬å¤©,Bukan di musim dingin
37c4088501e24367da96ddf30b088624f9ce49c8,ä»Šå¤©æ˜¯æ˜ŸæœŸå¹¾,Hari ini adalah minggu berapa
b2d91d8db2668823befcc93791178345c648d878,æ˜ŸæœŸå…­,Sabtu
abb8b2048262d669c08812b2c5a9ad37807b2bcb,éƒµå±€æœ‰é–‹å—,Puskesmas ada buka?
cf600e5b0add5bc9a026f38e1383158babb3c9db,æœ‰ åªæœ‰æ—©ä¸Šé–‹,Ada hanya pagi buka
a731c3f6bbfd99d2428563cbdfaa07045dadd76c,ç¾åœ¨å¹¾é»äº†,Sekarang berapa jam lagi
cbde6f9c4744f33fd3d615bf2fbef6380af3a4d6,å¿«ä¸­åˆäº†,Dekat tengah hari
e7153f951e2e28b1f0fb7b1ad50db7d51cbb1ff2,é ˜éŒ¢é‚„ä¾†å¾—åŠå—,Lapikan datang sampai?
535f440ce6cc2a3c40e1f8c289343c257249c9e0,å¿«çš„è©±é‚„ä¾†å¾—åŠ,Cepatçš„è©±é‚„ä¾†å¾—åŠ
f7da7df7a85db79e0136364d471864a219decce4,é€™å…’æœ‰éƒµå±€å—,Iniar ada kantor pos?
1c60931afabdbf5d9e76c95e450276812081c5e6,æœ‰å•Š,Ada ah
8d0480225434bca3e7a6050d53d55c5b384eab1d,å¾ˆé å—,Sangat jauhkah
2eb61fa61798f46c0a0923bfda6023181978b42b,ä¸æœƒå•¦ å¾ˆè¿‘,Janganå•¦ Sangat dekat
2a4466686a7f426f556b7ccac9345497812a0289,åœ¨å“ªè£¡å‘¢,Di mana?
73c851bb6fee8c2cace48ff011210128e2b35e88,é †è‘—è·¯ç›´èµ° ç„¶å¾Œå¾€åŒ—èµ°,Sebelah jalan lurus lalu ke utara jalan
a18cd42b321112e560e945bcac06998b0ba5c72e,æ˜¯åœ¨ç¸£æ”¿åºœçš„å“ªé‚Š,adalah di mana pihak pemerintah kabupaten
80798eabd40ba920fdc8e353e4bb7f14dcbb2028,å°±åœ¨ç¸£æ”¿åºœæ­£å‰æ–¹,Tepat di depan pemerintah kabupaten
e5412d64689848d4ce130d98bd878c013359af52,å“¦ æˆ‘çŸ¥é“äº† è¬è¬,å“¦ Saya tahu sudah ğŸ‘ terima kasih
877b38989c5b4e3085c390d4851ffac37812ad88,ä¸€è·¯å¹³å®‰ æ…¢èµ°,Selamat jalan. Pelan berjalan
6232259668e97063bf36c232479ca8353aaee4c6,ä½ è¦è²·ä»€éº¼,Anda mau beli apa
e90b587463f245afbd093d95ec0c3801d3cda0b2,æˆ‘è¦ è²·å¸½å­,Aku beli topi
25817de131e25e11c80c2983fd90150e6977b9b0,è«‹ä¸Šä¸‰æ¨“,Silakan naik lantai tiga
8db8272f600f7c2157f8e1aa041ec6c151d124a3,è¬è¬ æˆ‘çŸ¥é“äº†," Terima kasih, saya tahu"
6cac4cd83fbd3772c8a446fc4ea2422809cf2904,æˆ‘è¦è²·ä¸€é ‚å¸½å­,Aku mau beli topi.
db223b4331d6f0bb079d6da9b364ebf4f1d6335f,ä½ å–œæ­¡ä»€éº¼é¡è‰²çš„,Anda menyukai apa warna
11313e0a8fcb830173ac26bf92397d17fb0fd25b,ç™½è‰²æˆ–é»‘è‰²çš„,Putih atau hitam
ed0331e6fc7cc7d35059825bdc50e9499120c6ab,ä¾† è©¦è©¦é€™é ‚,datang coba ini atas
9408d2e040c0c12a044c6623cacec0ce68248647,é€™é ‚ç¨å¤§äº†äº› æ›é ‚å°ä¸€é»çš„çœ‹çœ‹,Ini puncak sedikit lebih besar di beberapa  ganti puncak kecil sedikit di lihat
0606cf960db268a7f018f7e8021d0d2ea41655ce,ç¨ç­‰ä¸€ä¸‹ æˆ‘å»æ‹¿,ç¨ç­‰ä¸€ä¸‹ æˆ‘å»æ‹¿
d05ee18016cf1f830b58b7ca0c7fd319ee11c597,é€™é ‚å¾ˆé©åˆ è«‹å• å¤šå°‘éŒ¢,Ini atas sangat cocok Tolong tanya  berapa harganya
a3b5f8dc9ded4aefd03c9f61a80930df0ad2fa87,ä½ æ˜å¤©æœƒä¾†èšæœƒå—,Kau akan datang besok berkumpul?
162df0655ae32181247e9b9131218baf7fd67b1c,å°ä¸èµ· æˆ‘æ˜å¤©æœ‰äº‹,Maaf saya punya hal besok
afcc3886b1815da97317c253224c59d6df8decc6,åªæœ‰ä½ æ²’æœ‰ä¾†åƒåŠ å–”,Hanya kau tidak datang berpartisipasiå–”
8e412f55c2d7cf43bd741a6e02b07c0091aad3ff,æ²’è¾¦æ³•å‘¢ ç¬¬äºŒå±†æˆ‘å†åƒåŠ ,æ²’è¾¦æ³•å‘¢ Kedua kalinya saya lagi ikut
d81d92ce6842dd06ba55fc4ecb012b011465d09c,æœƒè²»å¤šå°‘,Berapa akan biaya
d6895053211adde3e4d06f8c6493245b233e4557,æˆ‘è¦ç¹³æœƒè²»å—,Saya akan bayar biaya?
d674357ce28a57d02234d40f12caeaf1ae21dfba,ä½ é€™æ¬¡å…ˆä¸å¿…ç¹³,Anda kali ini enggak harus bayar
8094bb0f3707c362cf3348980e2aeaba75212713,æ˜ŸæœŸäº”è¦é–‹æœƒ ä½ æœ‰ç©ºå—,Jumat akan kebuka Anda punya waktu?
4b671c4c75ceab358bea25e99a1bcd19ad9a2efd,æŠ±æ­‰ æˆ‘è¦å»èŠ±è“®,Sorry Saya pergi ke bunga lotus
3edbf8478d22514b01cf24151c8d840cc7be3736,å“ªè£¡ å“ªè£¡ æˆ‘é‚„æœ‰å¾ˆå¤šä¸æœƒçš„,å“ªè£¡ å“ªè£¡ æˆ‘é‚„æœ‰å¾ˆå¤šä¸æœƒçš„
d8baef00ed4a7cf323358b08fa728cca165a5a63,æ˜¯èª°æ•™çš„å‘¢,Adalah siapa yang mengajar?
2590ef79aae8395579dbc1fccf13e258574b0345,æ˜¯é˜¿å…¬å’Œé˜¿å¬·,Adalah aå…¬ dan a
cd696a6fea405a9312afa2ef883ec257e178000d,ä½ éƒ½åœ¨è‡ºåŒ—è®€æ›¸ ä»–å€‘ä»€éº¼æ™‚å€™æ•™ä½ å‘¢,Anda semua di Taipei membaca Mereka kapan mengajar Anda?
64e357c19a20a734e71936eccf9e6eef4c6ec063,å­¸æ ¡æ”¾å‡æ™‚ æˆ‘éƒ½æœƒå›å®¶ æˆ‘å°±æ˜¯åœ¨é€™å€‹æ™‚å€™å­¸ç¿’çš„,Sekolah libur waktu Saya juga pulang Saya adalah di waktu ini belajarnya
fcc9b28bc01f90800a76828ebf8c312b85ac2df3,å“‡ å¥½èªçœŸ,"Wow, serius."
8037274ff6673ddaae76b761fc8509db4c78d9bc,é˜¿å…¬èªªåƒè¬ä¸è¦å¿˜äº†è‡ªå·²çš„æ¯èª,Aå…¬èªªåƒè¬ä¸è¦å¿˜äº†è‡ªå·²çš„æ¯èª
dd36afab43b1cc3ec9a915fd03af5e3bb0ccde7a,é˜¿å…¬æ˜¯æ•™äº›ä»€éº¼,Ajuk adalah ajar sesuatu apa
867aa1002799515ba934d65d1dba138d70107f5c,é™¤äº†é˜¿ç¾èª é‚„æœ‰èº«é«”ä¿å¥,Selain bahasa AmÃ©rika dan kesehatan tubuh
903b3d93078c6b2d20d94bf74e35a5157c92b992,å“‡ ä½ çš„é˜¿å…¬çœŸäº†ä¸èµ·,å“‡ Anda a-tuk sungguh luar biasa
ec7d833a0e8448a81b9976db47001eb8c6edffd9,å“¦ ç‚ºä»€éº¼,å“¦ Kenapa
6670fea44465f0259cd4175416e0d224dd9bf972,å“ˆ å¦³å¿˜äº†å“¦ ä»Šå¤©æ˜¯å¦³çš„ç”Ÿæ—¥å•Š,Ha å¦³å¿˜äº†å“¦ Hari ini adalah ulang tahunå¦³å•Š
a556c38005b4a9bdf3b49216ebd61266b67eea3c,å°å“¦,Untukå“¦
ae59ea91b9e6568d6b932816c70c54a71de6984f,ç¥ä½ ç”Ÿæ—¥å¿«æ¨‚,Selamat ulang tahunmu
51c606cf6cb0670f922ce1e3cb711476a4f6df2e,è¬è¬ æˆ‘å¾ˆé«˜èˆˆ ä½ çš„å‘¢ ä»€éº¼æ™‚å€™, Terima kasih Saya sangat senang ä½ çš„å‘¢ ä»€éº¼æ™‚å€™
305ca1a68e4c4ff579151f2b4cc739ed842009da,å°±å¿«åˆ°äº† ä¸‹å€‹ç¦®æ‹œ,Sudah dekat sampai minggu depan
9151c17664b317ec8bede499f758a8e1246e4299,é‚£ä½ å–œæ­¡ä»€éº¼å‘¢,Lalu kamu menyukai apa?
182dd4fbd3b95181f2fd143ca7a9344171bcea43,ä¸ç”¨å•¦ ä½ äººä¾† æˆ‘å°±å¾ˆé«˜èˆˆ,Tak perluå•¦ Kamu orang datang Aku saja sangat senang
2f972940ff604e79e57464299c6945ead1861499,é‚£éº¼ èµ°å§ æˆ‘å€‘å‡ºå»èµ°èµ°,Kalau begitu jalanlah. Kita keluar pergi pergi
98277031d1c9d31b685a9bf3c2e0b871ea3a930f,ä½ æœ‰å¹¾å€‹å…„å¼Ÿå§å¦¹,Anda punya beberapa saudara perempuan
028c44ae192ce4dd0d94a9eadafed124226824e3,æˆ‘æœ‰ä¸‰å€‹å…„å¼Ÿå§å¦¹,Saya memiliki tiga saudara perempuan
7a725a97e19813af9b51c6b9468569cc88a52c3f,ä½ æœ‰å“¥å“¥å—,Kau ada kakak?
cdce6bfcd578b5e3879b12b53296c1f7d7d2a979,æ²’æœ‰ æˆ‘æœ‰å§å§,Saya tak punya kakak perempuan
8265621cd3408a2b85055381345c79823853a381,ä½ çµå©šäº†å—,Kau menikah sudah?
9f1fc39b2fa3b375647af4e0613733bbd67a5455,æ˜¯çš„ æˆ‘æœ‰äºŒå€‹å°å­©,Ya yang Aku ada dua anak kecil
7cf0bd0368ec58d2519def826c72ef5ef828b228,äºŒå€‹éƒ½ä¸Šå°å­¸äº†å—,Kedua yang sekolah dasar sudah?
da9b17d9b90fddf712e30214fdb1ec145f053786,é‚„æ²’ å¤§çš„é‚„åœ¨è®€å¹¼ç¨šåœ’,Masih nggak besarnya masih di baca taman kanak-kanak
9cc5ffdf9a2178f0a63150f3c281b15d7940bdd2,é‚£å°çš„å‘¢,Yang kecil?
a6fda45b3e07ffc5540c0ec430e29228b4598b82,é‚„åœ¨è¥è¤“ä¸­ æ˜¯éƒ¨è½çš„å¥¶å¥¶ç…§é¡§ä»–,Masih di dalam Adalah nenek suku yang merawatnya
037345805627df6dd4cb5a2e64504dc3a4621f4d,ä½ æ˜¯åšä»€éº¼çš„,Kamu apa yang dari
252774876a9790615bad0b08420a55183e4637f9,æˆ‘ç•¶è­¦å¯Ÿ,Saya sebagai polisi
1138607c1464408e7e249194c2ac9508792eb395,è­¦å¯Ÿéƒ½å¿™å“ªäº›å·¥ä½œå‘¢,Polisi semua sibuk kerja apa?
74ba26d0509581d2ec0ca0a95f0b2bed56626e45,æˆ‘å€‘çš„å·¥ä½œéå¸¸ç¹é›œ,Kami pekerjaan sangat rumit
29a1fd6e249515f909a6f125bd67c296e8076c3a,æœ‰å“ªäº›å·¥ä½œå‘¢,Ada pekerjaan apa?
c5839707108189487bab298838fda46352406536,æŠ“å£äºº æŠ“å°å· è©æ¬ºçŠ¯,"Tangkap orang jahat, tangkap pencuri, penipu"
74b3f8243f1f739a2cc6bcb3753cc83d201c1ec7,å“‡ ä½ å€‘çš„å·¥ä½œçœŸä¸ç°¡å–®å“ª,å“‡ Pekerjaan kalian sungguh tak mudah ya
1306ede7dadb16b34255543099afffe7487359bb,æ˜¯å•Š é‚£ä½ å‘¢ ä½ æ˜¯åšä»€éº¼çš„å‘¢,Ya ah kau? Kau apa yang sedang kau lakukan?
09a07c39c306b2949676deb9bb55a45510af4926,æˆ‘ç•¶è€å¸«,Saya sebagai guru
67fe633c344acec7dc3b40385d285703537299d7,å–” ç•¶è€å¸«çœŸå¥½,å–” Ketika guru sungguh baik
8567b45b5cb341297f798a54eb1629c081da21f0,æˆ‘å€‘æƒ³è¦ç”¨æ™šé¤ é‚„æœ‰åä½å—,Kami ingin dengan makan malam Ada tempat duduk?
b005e8b2ebcf18fa29493edda80748d87aa43f83,æœ‰çš„ è«‹è·Ÿæˆ‘ä¾†,Ada yang Silakan ikut saya
70b57855cede1f4dedee9d87c3a6cc00b65ab961,é€™æ˜¯èœå–® è«‹åƒè€ƒ,Ini menu Silakan referensi
1b7d976918610296b17af9afd475979aa66d80d5,æœ‰ç‰¹åˆ¥æ¨è–¦çš„èœå—,Ada khusus rekomendasi yang makanan?
b2882f41d37cf348c8722f0212d976f4970c71b6,è—¤å¿ƒ å±±ç¾Œ ç¬ è²,è—¤å¿ƒ å±±ç¾Œ ç¬ è²
1d2a675ce547aed7be1f8970a8f2aaba15c3df94,è½èµ·ä¾†å¥½å¥½åƒ é‚£éº¼ æ¯ä¸€æ¨£éƒ½ç«¯å‡ºä¾†,è½èµ·ä¾†å¥½å¥½åƒ é‚£éº¼ æ¯ä¸€æ¨£éƒ½ç«¯å‡ºä¾†
33398b442b0be2c7ec0ddf3531b336c75c56527d,å¥½çš„ éœ€è¦ç™½é£¯å—,Butuhkan putih makan yang bagus?
1d653f818dec18eaa5ce3894107d41b7c27c49cc,æ˜¯çš„ ä¹Ÿè¦,Ya ya juga untuk
82ac06f631e2124be1e2da0d35d838512e837064,éœ€è¦é£²æ–™å—,Perlu minuman?
08f63d47ae7e6046c943b0a27a0cf1af62c79d79,å¥½ è«‹çµ¦æˆ‘å€‘å•¤é…’ æ±½æ°´å’ŒèŒ¶,"Baik tolong bagi kami bir, soda dan teh"
2b56dbb92fdf43932bedac250fedf0d3650e2cec,å¥½ æ²’å•é¡Œ,"Baik, nggak masalah"
e22432b15ecb2edf3f618aae68b046ac31e31e3b,æŠ±æ­‰ æˆ‘ä¾†æ™šäº† è·¯ä¸Šå¡è»Š,Sorry Saya datang terlambat  Jalan macet
b1beb33d783f0f32bcc1ce4d89a87b049bdf572d,ä½ æ­ä»€éº¼è»Šä¾†çš„,Anda naik mobil apa datang
a8d59207065e964248133ab90a63aed1980ec490,æˆ‘æ­å…¬è»Š ä½ å‘¢,"Aku naik bis, kamu?"
c8ea1e8a4036a413c5a4d1882d4be51f3643a0ff,æˆ‘èµ°è·¯ä¾† æˆ‘å®¶å¾ˆè¿‘,"Saya berjalan jalan, saya rumah sangat dekat"
4525f8411b90e79a0409076c63f8ec13ef666bed,æˆ‘å€‘æ­ä»€éº¼äº¤é€šå·¥å…·å»å…‰å¾©,Kita naik apa transportasi ke cahaya kembali
9a0f303aad0013090688e67e4f16eb6ee6639551,æ­ç«è»Šæ¯”è¼ƒå¿«,Menumpang kereta lebih cepat
8483e2706a3e150194ae2ef6cd84797a1987a22c,ç«è»Šå¹¾é»é–‹,Kereta api berapa dibuka
9d6ecaab4e50ae0fe7b3b99ba6be97caa91e1ca3,ä¹é»é˜,Jam sembilan
5fce38bf1dc5571f053919be4af448593747dadc,é€™æ¨£ä¸­åˆæ‰åˆ°å‘€,Jadi tengah hari baru sampaiå‘€
6d71474d5e7751cc625c15d686f2275c23af97ea,å¾ˆå¥½ åˆ°å®¶å°±å¯ä»¥åƒåˆé£¯äº†,Baiklah ke rumah bisa makan siang sudah.
bf3222030e6813a33797be24ef5d4b628f44414f,æˆ‘å¤ªå¤ªçš„è—¥,Saya istri's obat
a4129a1b2bc4725c4b3d68ed2c34ca7f1550b9fa,ä½ å¤ªå¤ªæ€éº¼å•¦,Kau terlalu kenapaå•¦
7c68d4c71764cbcae52d079cba649d6296614bb3,é ­ç—› å’³å—½åˆç™¼ç‡’ ä¸€ç›´æ²’å¥½è½‰,"Pikiran, batuk dan demam. Berlanjut tak membaik"
1a326725f8748eaeb29b80f518fa1a494ff336ac,æ€éº¼ä¸é€åˆ°é†«é™¢æª¢æŸ¥, Kenapa tidak dikirim ke rumah sakit pemeriksaan
bdbd3cf33d4f3491b1485908ec090893a09b2e97,å¥¹ èµ·ä¸ä¾†,Dia bangun tak datang
e81de542bc355bc93da2af8e0b9cfefdf76e7394,è¦å…ˆçµ¦é†«ç”Ÿæª¢æŸ¥ ä¸è¦äº‚åƒè—¥,Harus dulu ke dokter periksa Jangan kacau makan obat
408999f0ca312b78007711a1fd709964a1d41cd0,å¥½çš„ åƒéæ™šé£¯å¾Œè¼‰å¥¹éå», Baik  Makan Terakhir Makanan  Terus Bawa Dia Masa Lalu
bacad633d8f93762b66ed2b6e8c6a4dc56cd8f88,å«å¥¹å¤šå–æ°´ ä½†ä¸è¦å–å†°å†·çš„æ°´,Suruh dia minum lebih air Tapi jangan minum air dingin
bbc3bee607d92f3defe0a1f1aa5dafc25fe78581,çŸ¥é“äº† åˆ¥æ“”å¿ƒ å¦³è‡ªå·²ä¹Ÿè¦å¤šä¿é‡,Tahu sudah Jangan khawatir å¦³è‡ªå·²ä¹Ÿè¦å¤šä¿é‡
ccf9e99cf2dc09635d5f7a277d59cfc22aa1209a,ä½ æ˜¯å“ªä½å•Š,Anda siapa yang ah
bf1cd4469f8b69887922c12165f215674bd3e9f4,å–” æœ‰ä»€éº¼äº‹å—,å–” ada apa itu?
0b47d6c99576ee69a1b4bf7a497998010bed1c89,ä¸Šç´šå–®ä½æœ‰è«‹ è¦ç·¨è¼¯æ—èªæ•™æ,Unit atas ada permintaan Untuk mengedit bahan ajar bahasa etnis
838574ec7ddb8a840f6ce5cb9dba0e3731804689,é‚£éº¼ è«‹ç­‰ä¸€ä¸‹ æˆ‘å»å«ä»–,Kalau begitu tolong tunggu saja Saya pergi panggil dia
cdd583ff5ec631abbb86f9a7d1ed91cff41a9111,åƒéåˆé¤ä½ æœ‰äº‹å— æˆ‘å€‘èŠèŠå§,Makan siang kamu ada urusan? Kita ngobrol ngobrol
d5cd46c7b9dddcd2d4426b6e72c12a767d353a77,å¥½ é‚£éº¼æˆ‘å€‘åœ¨å“ªè£¡è¦‹é¢,Baiklah kita di mana bertemu
fa925278871b282a79c273c230317cdef21c48c3,åœ¨å…‰å¾©çš„èšæœƒæ‰€,Di tempat pertemuan yang terang kembali
113f71cb47eb800b52c625be01f1469a69ba53ce,å°±é€™éº¼æ±ºå®š,å°±é€™éº¼æ±ºå®š
b040b2ef9e14ee975a7ab2f0301db607820c48a9,ä½ æƒ³è¦ åƒ ä»€éº¼,Anda ingin  makan  apa
9804d5c30092b20fdae5c93d885710e6c24f3558,è½èªªé€™è£¡çš„é†ƒè‚‰å¾ˆé¦™ æˆ‘è¦é»é€™å€‹çœ‹çœ‹,è½èªªé€™è£¡çš„è‚‰å¾ˆé¦™ æˆ‘è¦é»é€™å€‹çœ‹çœ‹
3afbafdeb966d93419115efd93e5d171e2aa485f,ä½ çœŸçš„å¾ˆæ„›åƒé†ƒè‚‰è€¶ é‚„è¦é»ä»€éº¼,Kau benar-benar suka makan dagingye masih mau apa apa
d5aa02e1ad46dbf1440933bfdf22ea6fe6dc2657,è¸ç‰› èƒèŸ¹ è•¨é¡èœ é‚„æœ‰ç³¯ç±³é£¯, sapi èƒèŸ¹ è•¨ç±»èœè¿˜æœ‰ç³¯ç±³é£¯
5a8dea71a1e37c7f21c96773c0c4076e37012be3,æˆ‘å€‘è¦å–ä»€éº¼æ¹¯,Kami harus minum apaæ¹¯
6dd125bf338f23462defda6076d2160455d8edc8,è—¤å¿ƒæ¹¯æ€éº¼æ¨£,è—¤å¿ƒæ¹¯ bagaimana cara
4c1e870e39c6064d47e34cf2488ea6f975531157,å”‰å‘€ è—¤å¿ƒå¾ˆè‹¦ æ›åˆ¥çš„,å”‰å‘€ è—¤å¿ƒå¾ˆè‹¦ æ¢åˆ«çš„
26dbccc1324521e5338965374a67cdce41e99c00,é’è›™æ¹¯å‘¢ æˆ‘å¥½æƒ³å–å–”,Sup katak? Aku mah ingin minumå–”
1c0ee04c4bf1f63c022dda8159982e1b708df790,æˆ‘å•å•çœ‹ æœ‰æ²’æœ‰,Saya tanya lihat Adakah
200239c0a6d333f740160ff7ade827f4f055bc92,å¥½å§,Baiklah.
eb778f1917a4c892a5a0cd7cbc17ce76bdf3abba,ä½ çš„èˆˆè¶£æ˜¯ä»€éº¼,Apa minat Anda
59d5c1adfda25da7c3134bc15c16931cdbfba556,æˆ‘çš„èˆˆè¶£æ˜¯æ¸¸æ³³,Minat saya adalah renang
19a91de8d03064d2887f467f60495e809177429b,æ¸¸æ³³æœ‰ä»€éº¼å¥½è™•,Apa Manfaat berenang
d1c132d8f1f3a54180da462f3b7c65d25c54a5bd,å¯ä»¥ä½¿èº«é«”å¥åº· é‚„å¯ä»¥æ½›æ°´ å°„é­š å’Œæ’¿æµ·èœ,"Bisa membuat tubuh sehat Juga bisa menyelam, menembak ikan dan mengumpulkan seafood"
94efd8ad30330cc312c627851feee9ef3c8537a3,åœ¨ç‚ç†±çš„å¤å¤© éƒ¨è½çš„å©¦å¥³éƒ½å»æµ·é‚Šæ’¿è²é¡,Pada musim panas yang panas para wanita suku itu semua pergi ke tepi laut mencari kerang
36c3cdb59e705908fc2fb79d23a736bcc42cd8e4,ä½ çš„èˆˆè¶£æ˜¯ä»€éº¼å‘¢,Apa minat Anda?
8885241ef538a2c6cf606b3a508737ac4f657688,æˆ‘å–œæ­¡æ”å½±,Saya suka fotografi
9010cc4e41d0574e954ac0bf62e54b589d12f82d,å“‡ å¦‚æœæ˜¯æˆ‘ æˆ‘å°±æ‹æ”æµ·åº•ä¸–ç•Œ,å“‡ jika aku aku akan memotret dunia bawah laut
c521249f428f0c2c1d0bf88e3b5116a9e3d9c748,ä½ æ”¾å‡æ™‚éƒ½åšä»€éº¼,Kamu apa saja saat berlibur
18b93e3be9f39f03fb2897069fee5368e0142eb5,ç¨®èŠ± é‚„æœ‰ç¨®èœ é‚£ä½ å‘¢,Benih ada bunga biji sayuran. Nah kau?
0e8bda7ddfc92886f07d6dc5b4c0865323d77b3a,æˆ‘å»å±±ä¸Šæ‹æ”,Saya pergi ke gunung untuk syuting
0234b2fe9550dfa09e2816d551fdca31a922fcb4,ä½ æœ€å–œæ­¡ä»€éº¼å­£ç¯€ æ˜¯æ˜¥å¤© å¤å¤© ç§‹å¤©é‚„æ˜¯å†¬å¤©,"Anda menyukai musim mana Apakah musim semi, musim panas, musim gugur atau musim dingin"
126afb85f3019726ed87759325d5b60173dae9e9,æˆ‘æœ€å–œæ­¡å¤å¤©äº†,Saya paling suka musim panas sudah
5aff5ab219b751bcaf02f58c5d56b2effb677e95,ä½ ç‚ºä»€éº¼å–œæ­¡å¤å¤©,Kenapa Anda menyukai musim panas
2d4aef9346df1569f5205ef12ef21456f046f355,å› ç‚ºå¤å¤© å¯ä»¥æ¸¸æ³³ éƒ¨è½ä¹Ÿæœ‰è±å¹´ç¥­ é‚£ä½ å‘¢,Karena musim panas bisa berenang. Suku juga punya bonang festival. Nah kau?
ff003cc5f086547262a1cb41ca2c20024b1d2ceb,æˆ‘æœ€å–œæ­¡ç§‹å¤© å› ç‚ºç§‹å¤© ä¸å†·ä¸ç†±,Saya paling suka musim gugur karena musim gugur tidak dingin tak panas
f205d686c65dc1c1b11426eb9786ff7a7d3d22b1,æˆ‘è¦ºå¾— å¤å¤©é›–ç„¶å¾ˆç†± ä½†æ˜¯æ™šä¸Šå¾ˆæ¶¼çˆ½,"Saya merasa, meskipun musim panas sangat panas Tetapi malamnya sangat sejuk"
8fa1a7a8f59202b3bca180fedf044def444aad76,å¤å¤©çš„æœˆå…‰å¾ˆäº® é‚£ä½ å€‘éƒ½åšäº›ä»€éº¼å‘¢,Bulan musim panasnya cerah. Lalu kalian semua melakukan sesuatu apa?
71e4598784e5b094de97de503c99ce9a5c14bbbc,æˆ‘å€‘å”±æ­Œè·³èˆ æœ‰æ™‚å€™æˆ‘çš„çˆ¸çˆ¸æœƒèªªæ•…äº‹,Kami menyanyi tari tari Ada waktu ayah saya akan cerita
3cfea14d883199bd43e5a724898b4da6ea08389e,æ˜¯å–” ä½ å€‘çš„ç”Ÿæ´»çœŸä»¤äººç¾¨æ…•å“©,Ya yah kehidupan kalian benar-benar mengenaskanå“©
fd7102859073009fd49670ce2a5a2e1f73a02b6b,å°å‘€ åˆ°ç¾åœ¨æˆ‘é‚„æœƒåš®å¾€ä»¥å‰çš„ç”Ÿæ´»å‘¢,Untukå‘€ sampai sekarang saya akan lagi ngeliat kehidupan dulu?
aa645a1b179edb933a61b6f284927ef99242398f,è±å¹´ç¥­æ™‚ä½ æœƒå›éƒ¨è½å—,Bong tahun festival kamu akan balik suku?
ad2cfae27ba9788f76709c8b60642212377e9999,æ˜¯çš„ æˆ‘æœƒè·Ÿå­©å­ä¸€èµ·å›å»,Ya Saya akan pulang bersama anak-anak
662a8966009b6b4bcb2642cc4abf9ae275ad3b89,ä½ å€‘çš„è±å¹´ç¥­æ˜¯åœ¨å“ªå€‹æœˆä»½,Kamu yang tahun panjang festival adalah pada bulan mana
c2af072893c5df20d3435e2ed034260351321879,æ¯å¹´çš„ å…«æœˆä»½èˆ‰è¾¦ å…±äº”å¤©,diadakan setiap bulan Agustus Total lima hari
2c57aeaacae500cca49e1b6787913ee5b35d532c,è±å¹´ç¥­æœ‰ä»€éº¼é‡é»ç‰¹è‰²,Apa sorotan utama Festival Tahun Baru
5eddb3ce08be4165f01cdc9d9b20a9340fbc8460,éƒ¨è½çš„äººå…¨éƒ½ç››è£åƒåŠ ,Orang-orang suku semua berpakaian lebar untuk berpartisipasi
db17c4452b36c5ce4dabefbfc22970f0346cfbfe,ä¾†è³“å¯ä»¥åƒåŠ å—,æ¥è³“ bisa ikutå—
ea0172e55d30064a9b13b6d4ef1ef17b3570be29,ç•¶ç„¶å¯ä»¥ æˆ‘å€‘å¾ˆé«˜èˆˆä½ å€‘ä¾†åƒåŠ ,Tentu bisa Kami sangat senang kalian datang berpartisipasi
41c1eb2f1a9923a0c4b7655b47253a7c47561cb2,æˆ‘å€‘ä¹Ÿè¦ç©¿å‚³çµ±æœé£¾å—,Kami juga harus memakai kostum tradisional?
87a482810706d0827ae2fb4bdddd3a073082c4f0,æ˜¯çš„ æˆ‘å€‘ç©¿å‚³çµ±æœé£¾è·³èˆ,Ya dari Kami memakai kostum tradisional menari
35cb53fc249339a03c6b48a3919ee52dfa1773c5,é‚£å¤©é‚„æœ‰èˆ‰è¡Œå“ªäº›å„€å¼,Apa lagi upacara yang diadakan hari itu
