id,chinese,translation
776f9269ab831c99b0a5c9337d47490c8e79992f,åƒ, Makan
698564528a6b8fedd7820c8023ef9f1e09d87dbe,é‹å‹•,Olahraga
2877273f79ad684326ea0c743057a794a1d98a42,æ‰“ é›»è…¦,Truck komputer
825f09b04c721f307618ddff256cebcd15135b7e,æˆ‘çˆ¸çˆ¸æ˜¯ ä¸€ä½ å¥½è€å¸« ä»–çš„å­¸ç”Ÿéƒ½å¾ˆå–œæ­¡ä»–,Saya ayah adalah seorang guru yang baik murid-muridnya sangat menyukai dia
3477f481056977b22604a1a3726099a0ad1bb38b,æˆ‘åª½åª½æ˜¯ ä¸€ä½ å¥½åª½åª½ å¥¹å¾ˆæ„›æˆ‘å€‘,"Saya adalah ibu, Satu orang Ibu Baik Dia sangat mencintai kita"
85c95cdf57d50e07b2a3ba8ed4c1cd0c5dffb58d,å¥¹ä¹Ÿå¾ˆæœƒåšèœ æˆ‘å€‘éƒ½å¾ˆå–œæ­¡åƒ,Dia juga akan memasak makanan Kami juga suka makan
e77d8aa03b87bd85df96eaac152d713a94b9912f,æˆ‘å’Œå“¥å“¥æ˜¯å­¸ç”Ÿ,Saya dan kakak saya adalah siswa
ec4d709fd54951275301f3d7af2a59ecc22b0afe,æˆ‘å€‘å¾ˆå–œæ­¡é‹å‹•,Kami sangat menyukai olahraga
cabaaa9a7109a616db6dfb3b0c8ae07cf62bba1f,æˆ‘å¾ˆæœƒç•«ç•«,Saya akan melukis
c7520316e357db560c48e044d97b93422f482f65,å“¥å“¥å¾ˆæœƒæ‰“é›»è…¦,Kakak saya sangat akan main komputer
bed352dac058de3e0e59db8ead2c95802b32546b,æˆ‘å€‘æ¯å¤©ä¸€èµ·åƒæ™šé£¯ èŠå¤© æ‰€ä»¥æˆ‘å€‘éƒ½å¾ˆå¿«æ¨‚,Kami setiap hari bersama makan malam makan  chatting Jadi kami semua cepat senang
0451f336330aeacecc0a5352ca0704109e340276,ä¸ æˆ‘ä¸å–œæ­¡çœ‹é›»è¦–,Saya tidak suka nonton TV
06f0f9e51eb14b76166536d245ad57e14e6ece62,ä¸ æˆ‘ä¸å–œæ­¡åƒæ°´æœ,Saya tidak suka makan buah
525aa6e1a86d9719ca39269e60e38b8beb3dbe99,ä¸ æˆ‘ä¸å–œæ­¡é‹å‹•,Saya tidak suka olahraga
549c051f6d9a274cab037c69e9aa78f7f7d7dcc6,ä¸ æˆ‘ä¸å–œæ­¡æ‰“é›»è…¦,Saya tidak suka main komputer
e22db5feb55d15f0b959ff7c38773004cc7ec3fb,ä¸ æˆ‘ä¸å–œæ­¡è®€æ›¸,Saya tidak suka membaca
9303cecdf05e4c9cc41641181014600dcd738a6f,ä¸ æˆ‘ä¸å–œæ­¡å¯«å­—,Saya tidak suka menulis kata
bb4b1ace1544c85dbdcece95723fc42ea244d221,ä¸ æˆ‘ä¸å–œæ­¡å”±æ­Œ,Saya tidak suka bernyanyi
38ed4a447f8e0208d7d14384f47cd5180442e478,ä¸ æˆ‘ä¸å–œæ­¡è·³èˆ,Saya tidak suka menari
c181c9ae68debd1fd16c0d42f04b270a0fdb95c9,æ˜¯ æˆ‘å–œæ­¡çœ‹é›»è¦–,Saya adalah suka nonton televisi
3b89556eecf84f77c024e8322ffc5ef2451d8bf4,æ˜¯ æˆ‘å–œæ­¡åƒæ°´æœ,Saya suka makan buah
dafaba2fac64976916f2e707eb031939cbbdb7a9,æ˜¯ æˆ‘å–œæ­¡é‹å‹•,Saya menyukai olahraga
a0f33cc63c938721a67a2c18c43455cdbfbaec03,æ˜¯ æˆ‘å–œæ­¡æ‰“é›»è…¦,Adalah saya suka main komputer
1b2849569813e81aee1acf3a875a73aa51009cf5,æ˜¯ æˆ‘å–œæ­¡è®€æ›¸,Adalah Saya suka membaca
c8b9e05fec12a9f8f36dcf64e9a415b8c24dabe7,æ˜¯ æˆ‘å–œæ­¡å¯«å­—,Adalah saya suka menulis
b525a3799932906d138b1f25334c575d018676ea,æ˜¯ æˆ‘å–œæ­¡å”±æ­Œ,Saya adalah suka bernyanyi
882d28023000f7b9448cb5f8eaf7335a46e1ff17,æ˜¯ æˆ‘å–œæ­¡è·³èˆ,Saya suka menari
550ebe5ecf4fa0b72c01d0ecb68df87dfe9da19e,ä½ æœƒåšèœå—,Anda akan masak makanan?
d5bb5f611b213cdef0f2a1272ad73e0d794029d2,ä½ æœƒæ‰“é›»è…¦å—,Anda akan main komputer?
d23ccf6099ece8f96568a441f17eff9a0550ec78,ä½ æœƒå”±æ­Œå—,Kau akan bernyanyi?
481880238af90e28a0ea8916af638f9b5c65ed49,ä½ æœƒè·³èˆå—,Anda akan menari?
af84f3fbd4e6fa8f6272704d76773e8bd06ad8d8,ä½ æœƒç•«ç•«å—,Anda akan lukisan?
c23b04bfed62b05298cd48df634a5bc64b60eb00,ä¸ æˆ‘ä¸æœƒåšèœ,Tidak Saya tidak akan masak masak
5e60c0bf84d0ad35feac8667eaadf64948b95854,ä¸ æˆ‘ä¸æœƒæ‰“é›»è…¦,Tidak saya tidak akan bet komputer
f0531263add1df4395b276a3f0ef0d3bab6c2bd6,ä¸ æˆ‘ä¸æœƒå”±æ­Œ,Tidak Saya tidak akan bernyanyi
5a875ac2b2449ccc274ca515427253c8c04025b3,ä¸ æˆ‘ä¸æœƒè·³èˆ,Tidak Saya tidak akan menari
9c897a85fa151a007dddef4c97ae5cb87cda14ae,ä¸ æˆ‘ä¸æœƒç•«ç•«,Tidak Saya tidak akan lukisan
685f80c08423cb2c49d9e8f8bdae291cb421c3ff,ä½ å–œæ­¡åšç”šéº¼,Anda menyukai apa melakukan
a88fb80e25a81389fdfca7dcdfcc3e4667bb11c2,ä½ æœƒåšç”šéº¼,Kau akan melakukan apa
0c71d1b445d33f0834afcc2b3ebf1b9726d4286d,ä½ å–œæ­¡çœ‹é›»è¦–å—,Anda suka nonton televisi?
6aa4b94b5dc2fc69a4f59b0d596d649ffc75d527,æ˜¯ æˆ‘å–œæ­¡çœ‹é›»è¦–,Saya adalah suka nonton televisi
18c9fb9ee32b64d413de0798c3cde0ee2a9c317a,ä½ æœƒåšèœå—,Anda akan masak makanan?
89368cbf38eaf6384f7ed4b5adadac9024b98dc3,ä¸ æˆ‘ä¸æœƒåšèœ,Tidak Saya tidak akan masak masak
d036870c6529d97f2a43b6c7608b710cbc948bb9,ä½ æœƒåšç”šéº¼,Kau akan melakukan apa
256bed8408c881d7a91a9d9a0ac8ad4dd42d26d4,æˆ‘æœƒç·¨ç¹”,Saya akan merajut
ebca2383247a800102f995b1defd972b01248d2d,æ˜¯ æˆ‘æœƒåšèœ,Ya saya akan masak hidangan
0da0e91aa8ac057e3ebf9f612a72c14e3697939b,æ˜¯ æˆ‘æœƒæ‰“é›»è…¦,Ya saya akan main komputer
2739ba216a3ef99f6c5e8400a40b88c4ffcf7ead,æ˜¯ æˆ‘æœƒå”±æ­Œ,Ya saya akan bernyanyi
887527f82235c0a06fb2e445ffc7633f9e3796a5,æ˜¯ æˆ‘æœƒè·³èˆ,"Ya, saya akan menari"
a42e2ff500b8e363707c54166fd88a6a68608a93,æ˜¯ æˆ‘æœƒç•«ç•«,Ya saya akan lukisan
465c12b602c11415c8d6e746a6c8930ae0130e72,ä¸ æˆ‘ä¸å–œæ­¡ç•«ç•«,Saya tidak suka melukis
1049174b10e50eece486623ddf59adaa27f5ad2c,ä¸ æˆ‘ä¸å–œæ­¡é¨è…³è¸è»Š,Saya tidak suka naik sepedha.
95f64d51132b815f0540a5b313246642d3f12cec,æ˜¯ æˆ‘å–œæ­¡ç•«ç•«,Adalah saya suka melukis
17c6311df50c1014887138d1161cb06ee34155bb,æ˜¯ æˆ‘å–œæ­¡é¨è…³è¸è»Š,Adalah saya suka naik sepeda kaki
5e6bf5d6f96c323ae0766ee0bd1bae9aca486244,å–œæ­¡ æ„›,å–œæ¬¢ çˆ±
309eb16e13dc67a905483fc61c92b9addebb0250,æœƒ,Akan
a005766abcfe481e4eaad5e2a9ff0a58d51baeee,çœ‹ é›»è¦–,Watch TV
4d5a309ed1bb0aeda074faa81dd84dcde00d3dd6,åƒ, Makan
e32b0ab6018dafdb32109d25f91f2e349f903a83,é‹å‹•,Olahraga
8eb33f0ec985409ae4d5ebf61efadb7ec11f10e2,æ‰“ é›»è…¦,Truck komputer
44e4d90b68b886040411ec6a45881b20a2295175,åƒæ™šé£¯, Makan Malam
6ab9122bdade5946c9d24c4fde2e764064e20680,ä½ å–œæ­¡çœ‹é›»è¦–å—,Anda suka nonton televisi?
29cf36d59bd41f9fc7a2d5fbb6548930d55401a8,ä½ å–œæ­¡åƒæ°´æœå—,Anda suka makan buah?
0b9e14f24efef88940f5f68d51d88cd5402bd2d2,ä½ å–œæ­¡é‹å‹•å—,Anda menyukai olahraga?
bc738a1d7ef04f047d95b8d53d3055aac7128f89,ä½ å–œæ­¡æ‰“é›»è…¦å—,Anda suka main komputer?
dbee87ed397f92d39481db46ac2489ca22a84870,ä½ å–œæ­¡è®€æ›¸å—,Anda menyukai membaca?
44be43759da39925992e45e93105a49cc23839d9,ä½ å–œæ­¡å¯«å­—å—,Anda suka menulis?
430a4e6a8e3bf8a6c1d0d2bf8376041cb4f3918e,ä½ å–œæ­¡å”±æ­Œå—,Anda suka menyanyi?
0e8400953fe3f0e047196f0ed8e6a68e0281d0e3,ä½ å–œæ­¡è·³èˆå—,Anda suka menari?
e58f5e36755ba6ad9b6231a1dade796e662295cb,ä½ å–œæ­¡ç•«ç•«å—,Anda suka melukis?
43789f5270cbf7e1aefb44cd1b2ecd0c81845b29,ä½ å–œæ­¡é¨è…³è¸è»Šå—,Anda suka naik sepeda kaki?
41001cacee41651310b004a00e3993fcf66e23d0,ä½ é•·é«˜äº†å—,Kau tinggi sudah?
e510457ba4ccd3c7c910d901887b2926318f5672,ä½ è®Šèƒ–äº†å—,Kau menjadi gemuk?
54bce2ae01e07814ff35c26d28c5a384330d3891,ä½ é‚„ç•™è‘—é•·é ­é«®å—,Kau masih tinggalkan rambut panjang?
761f04e79e20b45211976bbc3e487bf4b3407ba1,ç•¶å¹´ä½ å¤©å¤©èªçœŸå­¸ç¿’ è‡‰ä¸Šæ°¸é å¸¶è‘—ç¬‘å®¹,"Ketika tahun Anda sehari serius belajar, wajah Anda selalu membawa senyuman"
1d141fa3ef1d8b03eafe905a313ea197e9d542bd,è€å¸«åŒå­¸éƒ½å¾ˆå–œæ­¡ä½ ,Guru dan sesama sekolah semua suka kamu
036a376d2f27cc1a12e39bee13ab0679c875269d,ä½ ç¾åœ¨é‚„æ˜¯ä¸€å€‹å—å¤§å®¶å–œæ„›çš„äººå—,Kau sekarang atau seorang yang disukai semua orang?
d1d9be69e500a1ab0916e206658c0954ec8b0155,ç•¶å¹´ä½ èªªä½ æƒ³æˆç‚ºä¸€åé†«å¸« å› ç‚ºä½ æƒ³å¹«åŠ©å¾ˆå¤šç”Ÿç—…çš„äºº,Ketika tahun Anda bilang Anda ingin menjadi seorang dokter karena Anda ingin membantu banyak orang yang sakit
29d6e969f6a9f94052eded19859c10e5451fe95d,ä½ ç¾åœ¨å¤©å¤©éƒ½åœ¨å¹«åŠ©ç—…äººå—,Anda sekarang setiap hari sedang membantu pasien?
374e97b1dd35d46be41135f0663c9e9cccfe68bd,ç•¶å¹´ä½ èªªä½ æƒ³åˆ°åœ‹å¤–çœ‹çœ‹ å¢åŠ è‡ªå·±çš„çŸ¥è­˜,Ketika tahun Anda bilang Anda berpikir ke luar negeri lihat  menambah pengetahuan Anda
1751585a97d3a549c8bc35f8dfcfdb1e0aefcacb,ä½ åˆ°ç¾åœ¨å·²ç¶“å»éå¹¾å€‹åœ‹å®¶äº†å‘¢,Anda sudah ke beberapa negara sampai sekarang?
97dfd7687efcdae2c73dc4601c954bff1c3fcde6,ç¥ä½ æ‰€æœ‰é¡˜æœ›éƒ½èƒ½å¯¦ç¾,Semoga semua keinginan Anda dapat terwujud
9d324087454972030047f9cbe2f5cf45b44623eb,é•·çš„ æ¢ç‹€ç‰©,Panjang shaped object
fa34e124ea54b7091e5d85994012f92fb0076250,å»éçš„,Sudah pergi
eefa819a5bb3d9a0b2512d54fb5d6e89c6552afa,è¶…é, melebihi
7144ce56b910b73b8e5496b9ab78fdd6ad71741e,äºŒå,Dua puluh
85239e4647a365bf14e389c22c650bd5be7fbdb5,ç•™è‘—,ç•™è‘—
f95f0039b41568d0d7438808ae7233310a2f8d44,æ°¸é ,Selamanya
002ce7c231aa4015dea0a8cd994e0656970d3608,ç¬‘å®¹, Smile
0eae619b75a0830f376892ac4662ba3c23fa418d,ç—…äºº,Pasien
970cb10bbe9879d9272d48f30f5d523223ac02eb,å¢åŠ ,
ec921a5dffb6b64fc9d47c60a1f0f289a8662725,å»é,Sudah pergi
01354193922c4dbde098df1afdc5705bbadbccfb,é¡˜æœ›,Keinginan
98f1956fb73870c06dd138214a76bfe93b0f76dc,å¯¦ç¾,Realisasi
b96b56b3beab9c60ef990a58bc14467b6077b0a9,é€™æ˜¯èª°å•Š ç•™è‘—é•·é ­é«® è‡‰ä¸Šä¹Ÿå¸¶è‘—ç¬‘å®¹,"Ini siapa ah, yang menjaga rambut panjang, dan di wajahnya juga membawa senyuman"
a3ae00ad167b2aea816291e1ee5f5b734f847442,é€™æ˜¯äºŒåå¹´å‰çš„æˆ‘ æˆ‘ç•¶æ™‚å¸Œæœ›æˆç‚ºä¸€åé†«å¸« å¯ä»¥å¹«åŠ©å¾ˆå¤šç—…äºº,Ini dua puluh tahun yang lalu saya. Saya waktu itu ingin menjadi seorang dokter dan bisa membantu banyak pasien
d082a747dae31cbad9e61dbe0275527881248194,æ‰€ä»¥ä½ ç¾åœ¨å¤©å¤©éƒ½åœ¨å¹«åŠ©ç—…äºº,Jadi Anda sekarang sehari hari sedang membantu pasien
caceab41c9899263450c0d62c2b831195c298e4c,ç•¶å¹´æˆ‘ä¹Ÿæƒ³åˆ°åœ‹å¤–çœ‹çœ‹ å¢åŠ è‡ªå·±çš„çŸ¥è­˜,"Tahun itu juga saya berpikir ke luar negeri lihat, menambah pengetahuan saya"
1d66b8ab68b3ad832020bf0e058b5f01d8b0cf51,æ‰€ä»¥ä½ åˆ°ç¾åœ¨å·²ç¶“å»éå¹¾å€‹åœ‹å®¶äº†,Jadi Anda sampai sekarang sudah ke beberapa negara.
aca06e51c8f2900a6f894977c45bab2efec8d5e4,æˆ‘å·²ç¶“å»éäºŒåå¹¾å€‹åœ‹å®¶äº†,Saya sudah ke dua puluh lebih negara.
2e80997554a12288b636ab98185b34a09e64c9e0,å¤§å®¶å¥½ ä»Šå¤©è¦å­¸ç¿’ä¸€äº›ç°¡å–®çš„è©å½™ æˆ‘å€‘é–‹å§‹å§,Semua orang baik hari ini akan belajar beberapa kata-kata sederhana. Kita mulailah
5c8f49ee843de800a972e0120ec94ef3497fc606,å…ˆè½è€å¸«å”¸ å†è·Ÿè‘—è€å¸«å”¸,"Pertama dengar guru mikir, lalu ngikut guru mikir"
1512b8a86d0bc3f522f6c6c2a9ac4d5824a19e44,è½è€å¸«çš„å•é¡Œ å›ç­”çœ‹çœ‹,è½è€å¸«çš„å•é¡Œ å›ç­”çœ‹çœ‹
ae8116f61c383dfaa716e54710e3a193b1520c32,å¤ªæ£’äº† ç¾åœ¨ æ›ä½ å€‘èªªèªªçœ‹,Terbaik sudah Sekarang æ›ä½ å€‘èªªèªªçœ‹
6888f118c6d1369e089ee4ed9635125c7d4b893b,ä»”ç´°è½è€å¸«çš„å•é¡Œ è©¦è‘—å›ç­”çœ‹çœ‹,Dengarkan dengan hati-hati pertanyaan guru dan coba jawab lihat
4a164d6902510310119d813d02039961c8f21e09,ä»”ç´°è½è€å¸«çš„å•é¡Œ ç­”æ¡ˆæ˜¯å“ªä¸€å€‹å‘¢, Dengarkan dengan hati-hati pertanyaan guru  Jawabannya adalah mana satu?
b65f8118ace3384ebac277f02e7a6e0028fea39c,å¤ªå²å®³äº† ç¾åœ¨ çœ‹çœ‹ä½ æ˜¯ä¸æ˜¯éƒ½èƒ½ç­”å°å–”,Terlalu hahahaha Sekarang. Lihat apakah kamu bisa jawab ya.
0c6d9e4a8d6e7c62c0904f3e3409f7778f48793d,å¤ªæ£’äº† è¦å†ä¸€æ¬¡å—,Terbaik sudah. Mau lagi sekali?
b3b754687c819a98aa26d7812992a00244093ce5,æ­å–œä½  å®Œæˆä»Šå¤©çš„å­¸ç¿’ æ¯å¤©åœ¨å®¶ä¹Ÿè¦ç·´ç¿’å”· ä½ æ‰æœƒé€²æ­¥å¾—å¾ˆå¿«å”·,Selamat Anda menyelesaikan pembelajaran hari ini Setiap hari juga harus berlatih di rumah Anda akan maju dengan cepat
210fb8ac90e79f543bdea8efaec69234d0ebf9d9,ç‰ æœ‰æ²’æœ‰è…³ æœ‰ ç‰ æœ‰è…³,Apa dia punya kaki Ada. Dia punya kaki
34071d3d913c71e946ec1734b0a020589f51ad54,ç‰ æœƒé£›å— ä¸ ç‰ ä¸æœƒé£›,Apakah ia akan terbang?  Tidak  ia tidak akan terbang
7f6479b136d92fa87cd052d8c90533764de9b0b2,ç‰ æœ‰ç‰™é½’å— æœ‰ ç‰ æœ‰ç‰™é½’,Dia punya gigi?  Dia Dia punya gigi
f2b8daf025985d19eca5a705eb66264d3f194030,é€™æ˜¯ä»€éº¼ é€™æ˜¯ç‹—,Ini apa anjing
210fb8ac90e79f543bdea8efaec69234d0ebf9d9,ç‰ æœ‰æ²’æœ‰è…³ æœ‰ ç‰ æœ‰è…³,Apa dia punya kaki Ada. Dia punya kaki
34071d3d913c71e946ec1734b0a020589f51ad54,ç‰ æœƒé£›å— ä¸ ç‰ ä¸æœƒé£›,Apakah ia akan terbang?  Tidak  ia tidak akan terbang
a67f464fa266000335a25ba3f24b69cc69bd6bdb,ç‰ æœ‰ç‰™é½’å— æ²’æœ‰ ç‰ æ²’æœ‰ç‰™é½’,Dia punya gigi? Tidak  Dia tidak punya gigi
dbb7ddcb260556bcc799ef02df7282f016862f16,é€™æ˜¯ä»€éº¼ é€™æ˜¯çƒé¾œ,Ini apaçƒé¾œ
210fb8ac90e79f543bdea8efaec69234d0ebf9d9,ç‰ æœ‰æ²’æœ‰è…³ æœ‰ ç‰ æœ‰è…³,Apa dia punya kaki Ada. Dia punya kaki
dcb4632adec67ee04279b98337d0c9353bf27b28,ç‰ æœƒé£›å— æ˜¯ ç‰ æœƒé£›,Dia akan terbang?  Ya  dia akan terbang
7f6479b136d92fa87cd052d8c90533764de9b0b2,ç‰ æœ‰ç‰™é½’å— æœ‰ ç‰ æœ‰ç‰™é½’,Dia punya gigi?  Dia Dia punya gigi
045a50a12ed54a69195ee2d111a3f78cbfd3ccad,é€™æ˜¯ä»€éº¼ é€™æ˜¯è™è ,Ini apa kelelawar
210fb8ac90e79f543bdea8efaec69234d0ebf9d9,ç‰ æœ‰æ²’æœ‰è…³ æœ‰ ç‰ æœ‰è…³,Apa dia punya kaki Ada. Dia punya kaki
dcb4632adec67ee04279b98337d0c9353bf27b28,ç‰ æœƒé£›å— æ˜¯ ç‰ æœƒé£›,Dia akan terbang?  Ya  dia akan terbang
a67f464fa266000335a25ba3f24b69cc69bd6bdb,ç‰ æœ‰ç‰™é½’å— æ²’æœ‰ ç‰ æ²’æœ‰ç‰™é½’,Dia punya gigi? Tidak  Dia tidak punya gigi
c8aa1c331596ba06a7230773df87538789745a1a,é€™æ˜¯ä»€éº¼ é€™æ˜¯è´è¶,Ini apa kupu-kupu
f1c4b4a52105c2e48567fbdc35020e401d616c46,ç‰ æœ‰æ²’æœ‰è…³ æ²’æœ‰ ç‰ æ²’æœ‰è…³,Dia punya kaki tidak Tidak Dia tidak punya kaki
34071d3d913c71e946ec1734b0a020589f51ad54,ç‰ æœƒé£›å— ä¸ ç‰ ä¸æœƒé£›,Apakah ia akan terbang?  Tidak  ia tidak akan terbang
7f6479b136d92fa87cd052d8c90533764de9b0b2,ç‰ æœ‰ç‰™é½’å— æœ‰ ç‰ æœ‰ç‰™é½’,Dia punya gigi?  Dia Dia punya gigi
f036396c152cbd21292cd1afb84a31684a4fff98,é€™æ˜¯ä»€éº¼ é€™æ˜¯è›‡,Ini apa ular
f1c4b4a52105c2e48567fbdc35020e401d616c46,ç‰ æœ‰æ²’æœ‰è…³ æ²’æœ‰ ç‰ æ²’æœ‰è…³,Dia punya kaki tidak Tidak Dia tidak punya kaki
34071d3d913c71e946ec1734b0a020589f51ad54,ç‰ æœƒé£›å— ä¸ ç‰ ä¸æœƒé£›,Apakah ia akan terbang?  Tidak  ia tidak akan terbang
a67f464fa266000335a25ba3f24b69cc69bd6bdb,ç‰ æœ‰ç‰™é½’å— æ²’æœ‰ ç‰ æ²’æœ‰ç‰™é½’,Dia punya gigi? Tidak  Dia tidak punya gigi
2e80997554a12288b636ab98185b34a09e64c9e0,å¤§å®¶å¥½ ä»Šå¤©è¦å­¸ç¿’ä¸€äº›ç°¡å–®çš„è©å½™ æˆ‘å€‘é–‹å§‹å§,Semua orang baik hari ini akan belajar beberapa kata-kata sederhana. Kita mulailah
5c8f49ee843de800a972e0120ec94ef3497fc606,å…ˆè½è€å¸«å”¸ å†è·Ÿè‘—è€å¸«å”¸,"Pertama dengar guru mikir, lalu ngikut guru mikir"
1512b8a86d0bc3f522f6c6c2a9ac4d5824a19e44,è½è€å¸«çš„å•é¡Œ å›ç­”çœ‹çœ‹,è½è€å¸«çš„å•é¡Œ å›ç­”çœ‹çœ‹
ae8116f61c383dfaa716e54710e3a193b1520c32,å¤ªæ£’äº† ç¾åœ¨ æ›ä½ å€‘èªªèªªçœ‹,Terbaik sudah Sekarang æ›ä½ å€‘èªªèªªçœ‹
6888f118c6d1369e089ee4ed9635125c7d4b893b,ä»”ç´°è½è€å¸«çš„å•é¡Œ è©¦è‘—å›ç­”çœ‹çœ‹,Dengarkan dengan hati-hati pertanyaan guru dan coba jawab lihat
4a164d6902510310119d813d02039961c8f21e09,ä»”ç´°è½è€å¸«çš„å•é¡Œ ç­”æ¡ˆæ˜¯å“ªä¸€å€‹å‘¢, Dengarkan dengan hati-hati pertanyaan guru  Jawabannya adalah mana satu?
b65f8118ace3384ebac277f02e7a6e0028fea39c,å¤ªå²å®³äº† ç¾åœ¨ çœ‹çœ‹ä½ æ˜¯ä¸æ˜¯éƒ½èƒ½ç­”å°å–”,Terlalu hahahaha Sekarang. Lihat apakah kamu bisa jawab ya.
0c6d9e4a8d6e7c62c0904f3e3409f7778f48793d,å¤ªæ£’äº† è¦å†ä¸€æ¬¡å—,Terbaik sudah. Mau lagi sekali?
b3b754687c819a98aa26d7812992a00244093ce5,æ­å–œä½  å®Œæˆä»Šå¤©çš„å­¸ç¿’ æ¯å¤©åœ¨å®¶ä¹Ÿè¦ç·´ç¿’å”· ä½ æ‰æœƒé€²æ­¥å¾—å¾ˆå¿«å”·,Selamat Anda menyelesaikan pembelajaran hari ini Setiap hari juga harus berlatih di rumah Anda akan maju dengan cepat
2e80997554a12288b636ab98185b34a09e64c9e0,å¤§å®¶å¥½ ä»Šå¤©è¦å­¸ç¿’ä¸€äº›ç°¡å–®çš„è©å½™ æˆ‘å€‘é–‹å§‹å§,Semua orang baik hari ini akan belajar beberapa kata-kata sederhana. Kita mulailah
5c8f49ee843de800a972e0120ec94ef3497fc606,å…ˆè½è€å¸«å”¸ å†è·Ÿè‘—è€å¸«å”¸,"Pertama dengar guru mikir, lalu ngikut guru mikir"
1512b8a86d0bc3f522f6c6c2a9ac4d5824a19e44,è½è€å¸«çš„å•é¡Œ å›ç­”çœ‹çœ‹,è½è€å¸«çš„å•é¡Œ å›ç­”çœ‹çœ‹
ae8116f61c383dfaa716e54710e3a193b1520c32,å¤ªæ£’äº† ç¾åœ¨ æ›ä½ å€‘èªªèªªçœ‹,Terbaik sudah Sekarang æ›ä½ å€‘èªªèªªçœ‹
6888f118c6d1369e089ee4ed9635125c7d4b893b,ä»”ç´°è½è€å¸«çš„å•é¡Œ è©¦è‘—å›ç­”çœ‹çœ‹,Dengarkan dengan hati-hati pertanyaan guru dan coba jawab lihat
4a164d6902510310119d813d02039961c8f21e09,ä»”ç´°è½è€å¸«çš„å•é¡Œ ç­”æ¡ˆæ˜¯å“ªä¸€å€‹å‘¢, Dengarkan dengan hati-hati pertanyaan guru  Jawabannya adalah mana satu?
b65f8118ace3384ebac277f02e7a6e0028fea39c,å¤ªå²å®³äº† ç¾åœ¨ çœ‹çœ‹ä½ æ˜¯ä¸æ˜¯éƒ½èƒ½ç­”å°å–”,Terlalu hahahaha Sekarang. Lihat apakah kamu bisa jawab ya.
0c6d9e4a8d6e7c62c0904f3e3409f7778f48793d,å¤ªæ£’äº† è¦å†ä¸€æ¬¡å—,Terbaik sudah. Mau lagi sekali?
b3b754687c819a98aa26d7812992a00244093ce5,æ­å–œä½  å®Œæˆä»Šå¤©çš„å­¸ç¿’ æ¯å¤©åœ¨å®¶ä¹Ÿè¦ç·´ç¿’å”· ä½ æ‰æœƒé€²æ­¥å¾—å¾ˆå¿«å”·,Selamat Anda menyelesaikan pembelajaran hari ini Setiap hari juga harus berlatih di rumah Anda akan maju dengan cepat
81330fba0bd6f30f03985b718b2375f3167892ee,é€™æ˜¯ä»€éº¼ é€™æ˜¯èš¯èš“,Ini apaèš¯èš“
e802c88e46ad1a6287f137a4c3ad1a19d3c4631d,å¤§å®¶å¥½ ä»Šå¤©è¦æ•™å¤§å®¶ä¸€äº›å‹•ç‰©è·Ÿå‹•ç‰©çš„ç‰¹å¾µ æˆ‘å€‘é–‹å§‹å§,Semua orang bagus hari ini akan mengajarkan kalian beberapa hewan dan ciri hewan Kita mulailah
9b226cc0b93d4f2f77ff576cf846241d6a242374,å…ˆè½è€å¸«å”¸ å†è·Ÿè‘—è€å¸«å”¸ è¦ä»”ç´°åœ°è½å”·,"Pertama dengar guru mikir, lalu ikutan guru mikir, harus mendengarkan dengan cermat"
6a2fd8b9c9dbc8897e3d9c46af65a56746e7edb8,å¾ˆå„ªç§€ ç¾åœ¨æˆ‘å€‘ç©ä¸€å€‹å°éŠæˆ² çœ‹çœ‹ä½ æ˜¯ä¸æ˜¯éƒ½å­¸æœƒäº†,Sangat unggul Sekarang kita main sebuah permainan kecil  lihat apakah kau adalah semua belajar akan ya
5abd6cc15d4277b92f9ab956993e848792c4be18,å”¸å¾—å¾ˆæ£’å”· è¦å†ä¸€æ¬¡å—,Bagus banget Mau lagi sekali?
b3b754687c819a98aa26d7812992a00244093ce5,æ­å–œä½  å®Œæˆä»Šå¤©çš„å­¸ç¿’ æ¯å¤©åœ¨å®¶ä¹Ÿè¦ç·´ç¿’å”· ä½ æ‰æœƒé€²æ­¥å¾—å¾ˆå¿«å”·,Selamat Anda menyelesaikan pembelajaran hari ini Setiap hari juga harus berlatih di rumah Anda akan maju dengan cepat
1c92ab3a4f05269621651a17c75c95d218378065,ä»–èƒ–å— æ˜¯ ä»–å¾ˆèƒ–,Dia gemuk? Ya Dia gemuk
29e6c530b29cb64b9b87360cb4ef13fdbc2168d5,ä»–é«˜å— æ˜¯ ä»–å¾ˆé«˜,Dia tinggi? Ya Dia tinggi
aa34b0bcebb3c27f621169057f4dad7174e9774a,ä»–æœ‰æˆ´çœ¼é¡å— æœ‰ ä»–æœ‰æˆ´çœ¼é¡,Dia punya kacamata? Ada Dia punya kacamata
fcd7c58fdaacaaf0eb9f2e99c5bd2dbf644abfb7,ä»–èƒ–å— ä¸ ä»–ä¸èƒ– ä»–å¾ˆç˜¦,Dia gemuk? Tidak Dia tak gemuk Dia sangat kurus
10b4a917c9f469c7f1747be2eff4af682d839ed2,ä»–é«˜å— ä¸ ä»–ä¸é«˜ ä»–å¾ˆçŸ®,Dia tinggi? Tidak Dia tak tinggi Dia sangat pendek
33f8de8d5a66956ed906588f0e432a436b7118ee,ä»–æœ‰æˆ´çœ¼é¡å— æ²’æœ‰ ä»–æ²’æœ‰æˆ´çœ¼é¡,Dia punya kacamata? Tidak Dia tidak memakai kacamata
1c92ab3a4f05269621651a17c75c95d218378065,ä»–èƒ–å— æ˜¯ ä»–å¾ˆèƒ–,Dia gemuk? Ya Dia gemuk
29e6c530b29cb64b9b87360cb4ef13fdbc2168d5,ä»–é«˜å— æ˜¯ ä»–å¾ˆé«˜,Dia tinggi? Ya Dia tinggi
33f8de8d5a66956ed906588f0e432a436b7118ee,ä»–æœ‰æˆ´çœ¼é¡å— æ²’æœ‰ ä»–æ²’æœ‰æˆ´çœ¼é¡,Dia punya kacamata? Tidak Dia tidak memakai kacamata
fcd7c58fdaacaaf0eb9f2e99c5bd2dbf644abfb7,ä»–èƒ–å— ä¸ ä»–ä¸èƒ– ä»–å¾ˆç˜¦,Dia gemuk? Tidak Dia tak gemuk Dia sangat kurus
10b4a917c9f469c7f1747be2eff4af682d839ed2,ä»–é«˜å— ä¸ ä»–ä¸é«˜ ä»–å¾ˆçŸ®,Dia tinggi? Tidak Dia tak tinggi Dia sangat pendek
aa34b0bcebb3c27f621169057f4dad7174e9774a,ä»–æœ‰æˆ´çœ¼é¡å— æœ‰ ä»–æœ‰æˆ´çœ¼é¡,Dia punya kacamata? Ada Dia punya kacamata
fcd7c58fdaacaaf0eb9f2e99c5bd2dbf644abfb7,ä»–èƒ–å— ä¸ ä»–ä¸èƒ– ä»–å¾ˆç˜¦,Dia gemuk? Tidak Dia tak gemuk Dia sangat kurus
29e6c530b29cb64b9b87360cb4ef13fdbc2168d5,ä»–é«˜å— æ˜¯ ä»–å¾ˆé«˜,Dia tinggi? Ya Dia tinggi
aa34b0bcebb3c27f621169057f4dad7174e9774a,ä»–æœ‰æˆ´çœ¼é¡å— æœ‰ ä»–æœ‰æˆ´çœ¼é¡,Dia punya kacamata? Ada Dia punya kacamata
1c92ab3a4f05269621651a17c75c95d218378065,ä»–èƒ–å— æ˜¯ ä»–å¾ˆèƒ–,Dia gemuk? Ya Dia gemuk
10b4a917c9f469c7f1747be2eff4af682d839ed2,ä»–é«˜å— ä¸ ä»–ä¸é«˜ ä»–å¾ˆçŸ®,Dia tinggi? Tidak Dia tak tinggi Dia sangat pendek
811178529cde247a6b506c3356c2d20066ed1420,å®ƒæ˜¯ä»€éº¼é¡è‰²çš„ å®ƒæ˜¯é»‘è‰²çš„,Apa warna itu. Itu hitam
4a9b5f1da04d6084731b7ed8c0f51c33a6990f0e,é€™å€‹æ±è¥¿åœ¨å“ªè£¡ å®ƒåœ¨å»šæˆ¿,é€™å€‹æ±è¥¿åœ¨å“ªè£¡ å®ƒåœ¨æˆ¿
f6ab111054de1b470b8e787a12dcb43cd3c79c26,æˆ‘å€‘ç”¨å®ƒä¾†åšä»€éº¼ æˆ‘å€‘ç”¨å®ƒä¾†è£é£Ÿç‰©,Kami pakai itu untuk apa Kami pakai itu untuk masukkan makanan
0381aba99c30f9996ac6a5764061f79630d67fee,é€™æ˜¯ä»€éº¼ é€™æ˜¯é‹å­,Ini apaé‹å­
7a853328afe44c09ee8abc7bb8e0f578ef6a7d5f,å®ƒæ˜¯ä»€éº¼é¡è‰²çš„ å®ƒæ˜¯ç´…è‰²çš„,Ini apa warna warna Ini merah warna
4a9b5f1da04d6084731b7ed8c0f51c33a6990f0e,é€™å€‹æ±è¥¿åœ¨å“ªè£¡ å®ƒåœ¨å»šæˆ¿,é€™å€‹æ±è¥¿åœ¨å“ªè£¡ å®ƒåœ¨æˆ¿
f6ab111054de1b470b8e787a12dcb43cd3c79c26,æˆ‘å€‘ç”¨å®ƒä¾†åšä»€éº¼ æˆ‘å€‘ç”¨å®ƒä¾†è£é£Ÿç‰©,Kami pakai itu untuk apa Kami pakai itu untuk masukkan makanan
df83d09e9e5c8f1027be41224fa7534ccd737880,é€™æ˜¯ä»€éº¼ é€™æ˜¯ç¢—,Ini apa mangkuk
350e73050d3e8f08a266329913daf7b5dcef845c,å®ƒæ˜¯ä»€éº¼é¡è‰²çš„ å®ƒæ˜¯ç™½è‰²çš„,Ini apa warna warna Ini putih
4a4e2e02d5445c5363a6926c51dc919f18ca3a56,é€™å€‹æ±è¥¿åœ¨å“ªè£¡ å®ƒåœ¨å»æ‰€,é€™å€‹æ±è¥¿åœ¨å“ªè£¡ å®ƒåœ¨å»æ‰€
d7103d49467c54b96936f9cb391b91c0622354a6,æˆ‘å€‘ç”¨å®ƒä¾†åšä»€éº¼ æˆ‘å€‘ç”¨å®ƒä¾†æ´—è‡‰,Kami pakai itu untuk apa Kami pakai itu untuk cuci wajah
